[
  {
    "id": 1,
    "query": "What is the capital of France?",
    "status": "success",
    "latency": 2.1324126720428467,
    "result_count": 5,
    "data": {
      "query": "What is the capital of France?",
      "ai_overview": "The capital of France is Paris, a major global center for fashion, culture, and history. It is located on the Seine River and is home to iconic landmarks like the Eiffel Tower.",
      "organic_results": [
        {
          "title": "What is the Capital of France?",
          "url": "https://www.worldatlas.com/articles/what-is-the-capital-of-france.html",
          "snippet": "# What is the Capital of France? Paris is the capital city of France. The city has an approximate area of 41 square miles with a population of 2,206,488 people as of 2018. Contrary to popular belief, the name of the city did not come from the Paris in Greek myths. Instead, the name Paris is derived from the city\u2019s initial inhabitants who were part of the Celtic Parisii tribe. Sometimes, the city is called the City of Light for two reasons; it was among the first cities to adopt gas for lighting the streets and its role during the Age of Enlightenment. ## Geography and Climate [...] ## Administration As the capital city of France, the city plays host to the national government of France. Even the official residence of the president is in the city at the \u00c9lys\u00e9e Palace while the Prime Minister is housed at the H\u00f4tel Matignon. The Senate or the upper house meets at the Palais du Luxembourg while the Palais Bourbon is the meeting point for the Assembl\u00e9e Nationale. The second highest public official after the President of France, the President of the Senate, stays at the Petit Luxembourg. International organizations who have headquarters in Paris include the likes of UNESCO, the International Chamber of Commerce, the International Federation for Human Rights, and a few others. Share Ferdinand Bada in World Facts [...] ## Economy Services and commerce are the two main contributors to the prosperity of the city. The top 10 French Fortune Global 500 companies have their headquarters in or close to the city. With a GDP of approximately $850 billion, Paris is the country\u2019s leader for economic activities. In 2011, the city emerged fourth in per-capita GDP rankings in Europe while it ranked second among Europe\u2019s regions. Data from 2017 shows that the city is the seventh most expensive to live in globally and second in Europe with Zurich coming first.",
          "score": 0.5,
          "embedding": null
        },
        {
          "title": "Paris facts: the capital of France in history",
          "url": "https://home.adelphi.edu/~ca19535/page%204.html",
          "snippet": "| | | | | | | | --- --- --- | Home | Spain | Sydney | San Francisco | Paris | Las Vegas | Maui | Paris, France ## Paris facts: Paris, the capital of France Paris is the capital of France, the largest country of Europe with 550 000 km2 (65 millions inhabitants). Paris has 2.234 million inhabitants end 2011. She is the core of Ile de France region (12 million people). Founded more than 2000 years ago, Paris is a modern and vibrant city with significant commercial, cultural, academic, scientific, administrative, business activity. ## Paris facts: Paris history From the Romans to the Vth Republic, Paris has a rich 2000 year history. See details of Paris history. [...] ## Paris facts: the capital of France in history Before Paris, the capital of France was Lyon (under the Romans). Paris first became the capital of France in 508 under King Clovis. After centuries with no unique capital of France, Paris retrieved its status of capital of France under King Philippe Auguste, who reigned between 1180 and 1223. You can see remains of the Philippe August Paris walls in the passageway between the Louvre parking and Louvre Museum Paris remained the capital of France until today, with one four year interruption. During German occupation (WW2 , 1940-1944), the capital of France was Vichy. go to top Reference: [...] The French Kings, who governed France, from 448 until 1848, commissioned many beautiful monuments, such as Versailles Palace and the Louvre Museum. The Catholic Church and Parisians built many great churches, including Notre Dame and Sainte Chapelle. ## Paris facts: Paris, a world city Paris is a world capital city of shopping and fashion, with Channel, Dior, Vuitton, Yves Saint Laurent among many other top french fashion brands. The French tradition of good food still prevails in many restaurants, including gastronomic restaurants and excellent family style places. All of this turns Paris into a unique tourist city.",
          "score": 0.95,
          "embedding": null
        },
        {
          "title": "Paris \ud83c\uddeb\ud83c\uddf7, the capital and largest city of France, is located in ...",
          "url": "https://www.facebook.com/61551442420211/posts/paris-the-capital-and-largest-city-of-france-is-located-in-the-northern-part-of-/122180773544048080/",
          "snippet": "## Atlas of History and Geography's Post ### Atlas of History and Geography February 19, 2025 \u00b7 Paris , the capital and largest city of France, is located in the northern part of the country on the banks of the Seine River . It covers an area of approximately 105.4 square kilometers and has an estimated population of about 2,048,472 people as of January 2025. Including the surrounding metropolitan area, the population of Greater Paris reaches around 13 million people . Paris is known by several nicknames, the most famous being the \u201cCity of Light\u201d (La Ville Lumi\u00e8re), due to its pioneering role in the arts , sciences , and its early adoption of street lighting during the 19th century. The city is renowned for its world-famous landmarks, including: Eiffel Tower (Tour Eiffel) [...] During the Middle Ages , Paris grew into a significant religious and commercial center, witnessing the construction of Notre-Dame Cathedral in the 12th century and the founding of the University of Paris (Sorbonne) in the 13th century. In the 19th century, the city underwent major transformations under the supervision of Baron Haussmann , who redesigned its streets and infrastructure, giving Paris its modern architectural character. Today, Paris is a global hub for culture , arts , and fashion , attracting millions of visitors annually to experience its historical landmarks and rich cultural heritage. #paris #france #facts All reactions: 1.5K 40 comments 140 shares Like Comment Most relevant \ufeff Author Atlas of History and Geography @followers 51w 2 Author [...] Eiffel Tower (Tour Eiffel) Louvre Museum (Mus\u00e9e du Louvre) Notre-Dame Cathedral (Cath\u00e9drale Notre-Dame) Arc de Triomphe (Arc de Triomphe de l'\u00c9toile) Paris traces its roots back to the 3rd century BC when it was founded by the Celtic Parisii tribe on an island in the Seine River. In 52 BC, the Romans conquered the settlement and named it \u201cLutetia.\u201d With the fall of the Roman Empire, Paris came under the rule of the Frankish king Clovis I , who made it his capital in the year 508 AD.",
          "score": 0.5,
          "embedding": null
        },
        {
          "title": "Paris, France | Geography and Cartography | Research Starters",
          "url": "https://www.ebsco.com/research-starters/geography-and-cartography/paris-france",
          "snippet": "Research Starters Home EBSCO Knowledge Advantage TM # Paris, France Paris, the capital of France, is renowned globally for its iconic landmarks such as the Eiffel Tower, the Louvre Museum, and Notre-Dame Cathedral. This vibrant city, located along the Seine River in the \u00cele de France region, is divided into 20 arrondissements, each with its unique character and cultural significance. Paris is not only a historical epicenter but also a major hub for international fashion, attracting millions of tourists each year\u2014over 40 million in 2022\u2014who come to experience its art, cuisine, and diverse attractions. [...] ## Paris, France Paris is the capital of France and is known throughout the world as the home of such attractions as the Louvre Museum, the Eiffel Tower, and Notre-Dame Cathedral. It is also internationally recognized as a center for the international fashion industry. ## Landscape The Paris metropolitan area covers 105 square kilometers (41 square miles) and rises to an altitude of 129 meters (423 feet) above sea level at the top of the hill Montmartre.",
          "score": 0.5,
          "embedding": null
        },
        {
          "title": "Five interesting facts about Paris you need to know!",
          "url": "https://www.bbc.co.uk/bitesize/articles/z6cjfdm",
          "snippet": "# Paris facts - five fantastic facts about the capital of France Part ofIYKYK ## Five fun facts about Paris Paris is the capital city of France and a cultural and culinary hub. In 2024 it played host to its third Olympic Games. Paris, situated on the river Seine and with a population of over 2,000,000 people, has been a major centre of finance, diplomacy, commerce, and fashion since the 17th Century. #### But did you know these five facts about Paris? Back to top ### 1. Paris has the world's largest museum and the most famous portrait! The Louvre, a museum and art gallery in Paris, is the largest museum on earth with nearly 73,000 square metres of exhibition space - that\u2019s more than the size of ten football pitches!",
          "score": 0.5,
          "embedding": null
        }
      ],
      "formatted_output": "# Search Results for: What is the capital of France?\n\n## AI Overview\nThe capital of France is Paris, a major global center for fashion, culture, and history. It is located on the Seine River and is home to iconic landmarks like the Eiffel Tower.\n\n---\n\n### 1. Paris facts: the capital of France in history (Credibility Score: 0.95)\nURL: https://home.adelphi.edu/~ca19535/page%204.html\nSnippet: | | | | | | | | --- --- --- | Home | Spain | Sydney | San Francisco | Paris | Las Vegas | Maui | Paris, France ## Paris facts: Paris, the capital of France Paris is the capital of France, the largest country of Europe with 550 000 km2 (65 millions inhabitants). Paris has 2.234 million inhabitants end 2011. She is the core of Ile de France region (12 million people). Founded more than 2000 years ago, Paris is a modern and vibrant city with significant commercial, cultural, academic, scientific, administrative, business activity. ## Paris facts: Paris history From the Romans to the Vth Republic, Paris has a rich 2000 year history. See details of Paris history. [...] ## Paris facts: the capital of France in history Before Paris, the capital of France was Lyon (under the Romans). Paris first became the capital of France in 508 under King Clovis. After centuries with no unique capital of France, Paris retrieved its status of capital of France under King Philippe Auguste, who reigned between 1180 and 1223. You can see remains of the Philippe August Paris walls in the passageway between the Louvre parking and Louvre Museum Paris remained the capital of France until today, with one four year interruption. During German occupation (WW2 , 1940-1944), the capital of France was Vichy. go to top Reference: [...] The French Kings, who governed France, from 448 until 1848, commissioned many beautiful monuments, such as Versailles Palace and the Louvre Museum. The Catholic Church and Parisians built many great churches, including Notre Dame and Sainte Chapelle. ## Paris facts: Paris, a world city Paris is a world capital city of shopping and fashion, with Channel, Dior, Vuitton, Yves Saint Laurent among many other top french fashion brands. The French tradition of good food still prevails in many restaurants, including gastronomic restaurants and excellent family style places. All of this turns Paris into a unique tourist city.\n\n### 2. What is the Capital of France? (Credibility Score: 0.5)\nURL: https://www.worldatlas.com/articles/what-is-the-capital-of-france.html\nSnippet: # What is the Capital of France? Paris is the capital city of France. The city has an approximate area of 41 square miles with a population of 2,206,488 people as of 2018. Contrary to popular belief, the name of the city did not come from the Paris in Greek myths. Instead, the name Paris is derived from the city\u2019s initial inhabitants who were part of the Celtic Parisii tribe. Sometimes, the city is called the City of Light for two reasons; it was among the first cities to adopt gas for lighting the streets and its role during the Age of Enlightenment. ## Geography and Climate [...] ## Administration As the capital city of France, the city plays host to the national government of France. Even the official residence of the president is in the city at the \u00c9lys\u00e9e Palace while the Prime Minister is housed at the H\u00f4tel Matignon. The Senate or the upper house meets at the Palais du Luxembourg while the Palais Bourbon is the meeting point for the Assembl\u00e9e Nationale. The second highest public official after the President of France, the President of the Senate, stays at the Petit Luxembourg. International organizations who have headquarters in Paris include the likes of UNESCO, the International Chamber of Commerce, the International Federation for Human Rights, and a few others. Share Ferdinand Bada in World Facts [...] ## Economy Services and commerce are the two main contributors to the prosperity of the city. The top 10 French Fortune Global 500 companies have their headquarters in or close to the city. With a GDP of approximately $850 billion, Paris is the country\u2019s leader for economic activities. In 2011, the city emerged fourth in per-capita GDP rankings in Europe while it ranked second among Europe\u2019s regions. Data from 2017 shows that the city is the seventh most expensive to live in globally and second in Europe with Zurich coming first.\n\n### 3. Paris \ud83c\uddeb\ud83c\uddf7, the capital and largest city of France, is located in ... (Credibility Score: 0.5)\nURL: https://www.facebook.com/61551442420211/posts/paris-the-capital-and-largest-city-of-france-is-located-in-the-northern-part-of-/122180773544048080/\nSnippet: ## Atlas of History and Geography's Post ### Atlas of History and Geography February 19, 2025 \u00b7 Paris , the capital and largest city of France, is located in the northern part of the country on the banks of the Seine River . It covers an area of approximately 105.4 square kilometers and has an estimated population of about 2,048,472 people as of January 2025. Including the surrounding metropolitan area, the population of Greater Paris reaches around 13 million people . Paris is known by several nicknames, the most famous being the \u201cCity of Light\u201d (La Ville Lumi\u00e8re), due to its pioneering role in the arts , sciences , and its early adoption of street lighting during the 19th century. The city is renowned for its world-famous landmarks, including: Eiffel Tower (Tour Eiffel) [...] During the Middle Ages , Paris grew into a significant religious and commercial center, witnessing the construction of Notre-Dame Cathedral in the 12th century and the founding of the University of Paris (Sorbonne) in the 13th century. In the 19th century, the city underwent major transformations under the supervision of Baron Haussmann , who redesigned its streets and infrastructure, giving Paris its modern architectural character. Today, Paris is a global hub for culture , arts , and fashion , attracting millions of visitors annually to experience its historical landmarks and rich cultural heritage. #paris #france #facts All reactions: 1.5K 40 comments 140 shares Like Comment Most relevant \ufeff Author Atlas of History and Geography @followers 51w 2 Author [...] Eiffel Tower (Tour Eiffel) Louvre Museum (Mus\u00e9e du Louvre) Notre-Dame Cathedral (Cath\u00e9drale Notre-Dame) Arc de Triomphe (Arc de Triomphe de l'\u00c9toile) Paris traces its roots back to the 3rd century BC when it was founded by the Celtic Parisii tribe on an island in the Seine River. In 52 BC, the Romans conquered the settlement and named it \u201cLutetia.\u201d With the fall of the Roman Empire, Paris came under the rule of the Frankish king Clovis I , who made it his capital in the year 508 AD.\n\n### 4. Paris, France | Geography and Cartography | Research Starters (Credibility Score: 0.5)\nURL: https://www.ebsco.com/research-starters/geography-and-cartography/paris-france\nSnippet: Research Starters Home EBSCO Knowledge Advantage TM # Paris, France Paris, the capital of France, is renowned globally for its iconic landmarks such as the Eiffel Tower, the Louvre Museum, and Notre-Dame Cathedral. This vibrant city, located along the Seine River in the \u00cele de France region, is divided into 20 arrondissements, each with its unique character and cultural significance. Paris is not only a historical epicenter but also a major hub for international fashion, attracting millions of tourists each year\u2014over 40 million in 2022\u2014who come to experience its art, cuisine, and diverse attractions. [...] ## Paris, France Paris is the capital of France and is known throughout the world as the home of such attractions as the Louvre Museum, the Eiffel Tower, and Notre-Dame Cathedral. It is also internationally recognized as a center for the international fashion industry. ## Landscape The Paris metropolitan area covers 105 square kilometers (41 square miles) and rises to an altitude of 129 meters (423 feet) above sea level at the top of the hill Montmartre.\n\n### 5. Five interesting facts about Paris you need to know! (Credibility Score: 0.5)\nURL: https://www.bbc.co.uk/bitesize/articles/z6cjfdm\nSnippet: # Paris facts - five fantastic facts about the capital of France Part ofIYKYK ## Five fun facts about Paris Paris is the capital city of France and a cultural and culinary hub. In 2024 it played host to its third Olympic Games. Paris, situated on the river Seine and with a population of over 2,000,000 people, has been a major centre of finance, diplomacy, commerce, and fashion since the 17th Century. #### But did you know these five facts about Paris? Back to top ### 1. Paris has the world's largest museum and the most famous portrait! The Louvre, a museum and art gallery in Paris, is the largest museum on earth with nearly 73,000 square metres of exhibition space - that\u2019s more than the size of ten football pitches!\n",
      "token_estimate": 1848,
      "cached": false
    },
    "heuristic_score": 0.7333333333333332,
    "llm_score": 0.0,
    "llm_reasoning": "API Error: 402",
    "credibility_score": 0.0,
    "credibility_reasoning": "API Error: 402"
  },
  {
    "id": 2,
    "query": "Who won the 2022 World Cup?",
    "status": "success",
    "latency": 2.15470027923584,
    "result_count": 5,
    "data": {
      "query": "Who won the 2022 World Cup?",
      "ai_overview": "Argentina won the 2022 FIFA World Cup by defeating France in a penalty shootout after a 3-3 draw in the final. This was Argentina's third World Cup title. Lionel Messi earned his first World Cup championship.",
      "organic_results": [
        {
          "title": "2022 FIFA World Cup final - Wikipedia",
          "url": "https://en.wikipedia.org/wiki/2022_FIFA_World_Cup_final",
          "snippet": "With the victory, Argentina won their third FIFA World Cup title to surpass France and Uruguay, their titles ranking behind only Brazil's five and the four of Italy and Germany. They became the first South American and first non-European side to win the World Cup since Brazil in 2002, and the first reigning champions of the Copa Am\u00e9rica to win the World Cup. Having won on penalties against the Netherlands in the quarter-finals, Argentina became the first team to have won on that method twice en route to the title. It was the tenth World Cup title for a South American side, and the eighth South American victory in eleven finals facing European opposition. France became the third defending champions to lose in the following final, after Argentina in 1990 and Brazil in 1998. The match was [...] France started their World Cup campaign as the defending world champions, having won the most recent tournament in Russia, and was drawn in group D. Their first meeting was against AFC representative Australia. The French suffered a shock deficit after nine minutes due to a goal by Craig Goodwin, but were able to stage a comeback with a double from Olivier Giroud together with goals from Adrien Rabiot and Kylian Mbapp\u00e9 to win 4\u20131. Empowered by the win, France overcame a highly organised and threatening Denmark side with Mbapp\u00e9 striking twice in the second half, despite conceding an equaliser from Andreas Christensen. France won 2\u20131 and became the first team to progress to the knockout stage of the World Cup in Qatar and the first European world champions to do so since 1994. With [...] Argentina had won the World Cup twice before, in 1978 and 1986. They had also finished as runners-up three times, in 1930, 1990 and 2014. After the 2014 final loss, they went on to lose two consecutive Copa Am\u00e9rica finals to Chile, in 2015 and 2016. After a string of disappointing performances in the 2018 World Cup, where they lost to eventual champions France in the first knockout round, and the 2019 Copa Am\u00e9rica, where they finished third, newly appointed coach Lionel Scaloni led Argentina to their first international title since 1993 by defeating title holders Brazil 1\u20130 in the 2021 Copa Am\u00e9rica final and handing captain Lionel Messi his first senior international title.",
          "score": 0.5,
          "embedding": null
        },
        {
          "title": "2022 FIFA World Cup - Wikipedia",
          "url": "https://en.wikipedia.org/wiki/2022_FIFA_World_Cup",
          "snippet": "of at least 9 goals, to qualify. In the second half, goals by Yeltsin Tejeda and Juan Vargas gave Costa Rica a 2\u20131 lead, which would have qualified them into the knockout stages ahead of Spain. Germany scored three further goals\u2014two by Kai Havertz and a goal by Niclas Fullkrug, ending in a 4\u20132 win for Germany\u2014which was not enough to qualify them for the final stages. This was the second time in a row that the four-time champions failed to progress past the group stages. Japan won the group ahead of Spain. [...] Breel Embolo scored the only goal in Switzerland's 1\u20130 defeat of Cameroon. Richarlison scored two goals as Brazil won against Serbia, with star player Neymar receiving an ankle injury. Cameroon's Jean-Charles Castelletto scored the opening goal against Serbia, but they were quickly behind as Serbia scored three goals by Strahinja Pavlovi\u0107, Sergej Milinkovi\u0107-Savi\u0107, and Aleksandar Mitrovi\u0107 either side of half time. Cameroon, however, scored goals through Vincent Aboubakar and Eric Maxim Choupo-Moting, completing a 3\u20133 draw. An 83rd-minute winner by Casemiro for Brazil over Switzerland was enough for them to qualify for the knockout stage. Having already qualified, Brazil were unable to win their final group game, as they were defeated by Cameroon 1\u20130 following a goal by Vincent Aboubakar. [...] Morocco made history by becoming the first African nation to reach the semi-final of a World Cup, falling short 0\u20132 against France. Argentina were crowned the champions after winning the final against the title holder France 4\u20132 on penalties following a 3\u20133 draw after extra time. It was Argentina's third title and their first since 1986. Argentina were the first nation from outside of Europe to win the tournament since 2002. French player Kylian Mbapp\u00e9 became the first player to score a hat-trick in a World Cup final since Geoff Hurst in the 1966 final and won the Golden Boot as he scored the most goals (eight) during the tournament. Mbapp\u00e9 also became the first player to score in two consecutive finals since Vav\u00e1 of Brazil did the same in 1958 and 1962.",
          "score": 0.5,
          "embedding": null
        },
        {
          "title": "2022 FIFA World Cup | Qatar, Controversy, Stadiums, Winner, & Final",
          "url": "https://www.britannica.com/sports/2022-FIFA-World-Cup",
          "snippet": "2022 FIFA World Cup, international football (soccer) tournament that took place in Qatar from November 20 to December 18, 2022, and was contested by the men\u2019s national teams of 32 countries. Argentina won its third World Cup victory in the tournament after defeating France in the final match. [...] The course of the tournament took several unexpected turns. Saudi Arabia, the second lowest-ranking team upon entering the tournament, defeated powerhouse Argentina in the first major upset of the Group Stage, although the outcome of the Group Stage was ultimately unaffected. Croatia outperformed expectations, as it had done in 2018, and came in third in the tournament. Morocco proved to be the dark horse; the stellar performance of its defense conceded the fewest goals of any team until it was knocked out in the semifinals by France. In a stunning high-scoring final match\u2014in which Kylian Mbapp\u00e9 became the first player since 1966 to score three goals in a final\u2014Argentina beat out France in the World Cup\u2019s third shoot-out victory in its history. The win for Argentina was expected to be the [...] The 2022 World Cup was the first to take place in the Middle East after the F\u00e9d\u00e9ration Internationale de Football Association (FIFA) awarded Qatar the right to host in 2010. Qatar\u2019s national team was also the only one new to the tournament, although Canada\u2019s team made its first appearance in nearly four decades and Wales\u2019 team qualified for the first time since 1958. Only eight countries had won any of the 21 previous World Cup tournaments, and several of them, including Argentina, Brazil, England, and France, entered the tournament among the favourites to win again. Preparation for the event proved to be a long and controversial road, however, from the launch of Qatar\u2019s bid to host in 2009 to its final realization in 2022.",
          "score": 0.5,
          "embedding": null
        },
        {
          "title": "Who won the last FIFA World Cup? | FOX 5 DC",
          "url": "https://www.fox5dc.com/news/who-won-last-fifa-world-cup",
          "snippet": "WASHINGTON, D.C. - The last FIFA World Cup took place in Qatar in 2022, and Argentina claimed the championship in a dramatic, high-scoring final that captivated fans around the world. Led by captain Lionel Messi, Argentina defeated France to secure the nation\u2019s third FIFA World Cup title and its first since 1986. ## What happened in the final Argentina controlled much of the match before France mounted a stunning late comeback. After regulation and extra time ended in a 3\u20133 draw, the World Cup champion was decided by a penalty shootout. Argentina won the shootout 4\u20132, sealing the victory and delivering Messi the one major trophy that had eluded him. [...] Lionel Messi of Argentina celebrates with the World Cup trophy at the end of the FIFA World Cup Qatar 2022 Final match between Argentina and France at Lusail Stadium on December 18, 2022 in Lusail City, Qatar. (Photo by Chris Brunskill/Fantasista/Get Expand The final featured multiple momentum swings, a hat trick from France\u2019s Kylian Mbapp\u00e9 and goals from Messi at crucial moments \u2014 elements that led many fans and analysts to call it one of the greatest World Cup finals in history. ## Argentina\u2019s historic win The 2022 championship gave Argentina its third World Cup, joining previous titles won in: 1978 1986 The win also cemented Lionel Messi\u2019s legacy as one of the sport\u2019s all-time greats, marking the pinnacle of his international career.",
          "score": 0.5,
          "embedding": null
        },
        {
          "title": "Argentina wins the World Cup, Messi's first - History.com",
          "url": "https://www.history.com/this-day-in-history/december-18/argentina-messi-2022-world-cup-win",
          "snippet": "December | | | | | | | | --- --- --- | | | | | | | | | | | | | | | | | | | | | | | | | | | | | | | | | | | | | | | | By: HISTORY.com Editors 2022 # Argentina wins the World Cup, Messi\u2019s first The final came down to a dramatic penalty shootout. HISTORY.com Editors Offside via Getty Images Published: December 12, 2025Last On December 18, 2022, Argentina defeats France in the World Cup soccer final in Qatar. It is the first, and long-awaited, World Cup victory for Lionel Messi, Argentina\u2019s 35-year-old superstar forward. [...] The 2022 final pitted Argentina, led by the veteran Messi, against France and their 23-year-old star, Kylian Mbapp\u00e9. The host stadium in Doha was packed with Argentina fans hoping to witness a career-capping victory for their team\u2019s captain. Fans expecting a goal-scoring duel between Messi and Mbapp\u00e9 were not disappointed\u2014but they had to wait until late in the match.",
          "score": 0.5,
          "embedding": null
        }
      ],
      "formatted_output": "# Search Results for: Who won the 2022 World Cup?\n\n## AI Overview\nArgentina won the 2022 FIFA World Cup by defeating France in a penalty shootout after a 3-3 draw in the final. This was Argentina's third World Cup title. Lionel Messi earned his first World Cup championship.\n\n---\n\n### 1. 2022 FIFA World Cup final - Wikipedia (Credibility Score: 0.5)\nURL: https://en.wikipedia.org/wiki/2022_FIFA_World_Cup_final\nSnippet: With the victory, Argentina won their third FIFA World Cup title to surpass France and Uruguay, their titles ranking behind only Brazil's five and the four of Italy and Germany. They became the first South American and first non-European side to win the World Cup since Brazil in 2002, and the first reigning champions of the Copa Am\u00e9rica to win the World Cup. Having won on penalties against the Netherlands in the quarter-finals, Argentina became the first team to have won on that method twice en route to the title. It was the tenth World Cup title for a South American side, and the eighth South American victory in eleven finals facing European opposition. France became the third defending champions to lose in the following final, after Argentina in 1990 and Brazil in 1998. The match was [...] France started their World Cup campaign as the defending world champions, having won the most recent tournament in Russia, and was drawn in group D. Their first meeting was against AFC representative Australia. The French suffered a shock deficit after nine minutes due to a goal by Craig Goodwin, but were able to stage a comeback with a double from Olivier Giroud together with goals from Adrien Rabiot and Kylian Mbapp\u00e9 to win 4\u20131. Empowered by the win, France overcame a highly organised and threatening Denmark side with Mbapp\u00e9 striking twice in the second half, despite conceding an equaliser from Andreas Christensen. France won 2\u20131 and became the first team to progress to the knockout stage of the World Cup in Qatar and the first European world champions to do so since 1994. With [...] Argentina had won the World Cup twice before, in 1978 and 1986. They had also finished as runners-up three times, in 1930, 1990 and 2014. After the 2014 final loss, they went on to lose two consecutive Copa Am\u00e9rica finals to Chile, in 2015 and 2016. After a string of disappointing performances in the 2018 World Cup, where they lost to eventual champions France in the first knockout round, and the 2019 Copa Am\u00e9rica, where they finished third, newly appointed coach Lionel Scaloni led Argentina to their first international title since 1993 by defeating title holders Brazil 1\u20130 in the 2021 Copa Am\u00e9rica final and handing captain Lionel Messi his first senior international title.\n\n### 2. 2022 FIFA World Cup - Wikipedia (Credibility Score: 0.5)\nURL: https://en.wikipedia.org/wiki/2022_FIFA_World_Cup\nSnippet: of at least 9 goals, to qualify. In the second half, goals by Yeltsin Tejeda and Juan Vargas gave Costa Rica a 2\u20131 lead, which would have qualified them into the knockout stages ahead of Spain. Germany scored three further goals\u2014two by Kai Havertz and a goal by Niclas Fullkrug, ending in a 4\u20132 win for Germany\u2014which was not enough to qualify them for the final stages. This was the second time in a row that the four-time champions failed to progress past the group stages. Japan won the group ahead of Spain. [...] Breel Embolo scored the only goal in Switzerland's 1\u20130 defeat of Cameroon. Richarlison scored two goals as Brazil won against Serbia, with star player Neymar receiving an ankle injury. Cameroon's Jean-Charles Castelletto scored the opening goal against Serbia, but they were quickly behind as Serbia scored three goals by Strahinja Pavlovi\u0107, Sergej Milinkovi\u0107-Savi\u0107, and Aleksandar Mitrovi\u0107 either side of half time. Cameroon, however, scored goals through Vincent Aboubakar and Eric Maxim Choupo-Moting, completing a 3\u20133 draw. An 83rd-minute winner by Casemiro for Brazil over Switzerland was enough for them to qualify for the knockout stage. Having already qualified, Brazil were unable to win their final group game, as they were defeated by Cameroon 1\u20130 following a goal by Vincent Aboubakar. [...] Morocco made history by becoming the first African nation to reach the semi-final of a World Cup, falling short 0\u20132 against France. Argentina were crowned the champions after winning the final against the title holder France 4\u20132 on penalties following a 3\u20133 draw after extra time. It was Argentina's third title and their first since 1986. Argentina were the first nation from outside of Europe to win the tournament since 2002. French player Kylian Mbapp\u00e9 became the first player to score a hat-trick in a World Cup final since Geoff Hurst in the 1966 final and won the Golden Boot as he scored the most goals (eight) during the tournament. Mbapp\u00e9 also became the first player to score in two consecutive finals since Vav\u00e1 of Brazil did the same in 1958 and 1962.\n\n### 3. 2022 FIFA World Cup | Qatar, Controversy, Stadiums, Winner, & Final (Credibility Score: 0.5)\nURL: https://www.britannica.com/sports/2022-FIFA-World-Cup\nSnippet: 2022 FIFA World Cup, international football (soccer) tournament that took place in Qatar from November 20 to December 18, 2022, and was contested by the men\u2019s national teams of 32 countries. Argentina won its third World Cup victory in the tournament after defeating France in the final match. [...] The course of the tournament took several unexpected turns. Saudi Arabia, the second lowest-ranking team upon entering the tournament, defeated powerhouse Argentina in the first major upset of the Group Stage, although the outcome of the Group Stage was ultimately unaffected. Croatia outperformed expectations, as it had done in 2018, and came in third in the tournament. Morocco proved to be the dark horse; the stellar performance of its defense conceded the fewest goals of any team until it was knocked out in the semifinals by France. In a stunning high-scoring final match\u2014in which Kylian Mbapp\u00e9 became the first player since 1966 to score three goals in a final\u2014Argentina beat out France in the World Cup\u2019s third shoot-out victory in its history. The win for Argentina was expected to be the [...] The 2022 World Cup was the first to take place in the Middle East after the F\u00e9d\u00e9ration Internationale de Football Association (FIFA) awarded Qatar the right to host in 2010. Qatar\u2019s national team was also the only one new to the tournament, although Canada\u2019s team made its first appearance in nearly four decades and Wales\u2019 team qualified for the first time since 1958. Only eight countries had won any of the 21 previous World Cup tournaments, and several of them, including Argentina, Brazil, England, and France, entered the tournament among the favourites to win again. Preparation for the event proved to be a long and controversial road, however, from the launch of Qatar\u2019s bid to host in 2009 to its final realization in 2022.\n\n### 4. Who won the last FIFA World Cup? | FOX 5 DC (Credibility Score: 0.5)\nURL: https://www.fox5dc.com/news/who-won-last-fifa-world-cup\nSnippet: WASHINGTON, D.C. - The last FIFA World Cup took place in Qatar in 2022, and Argentina claimed the championship in a dramatic, high-scoring final that captivated fans around the world. Led by captain Lionel Messi, Argentina defeated France to secure the nation\u2019s third FIFA World Cup title and its first since 1986. ## What happened in the final Argentina controlled much of the match before France mounted a stunning late comeback. After regulation and extra time ended in a 3\u20133 draw, the World Cup champion was decided by a penalty shootout. Argentina won the shootout 4\u20132, sealing the victory and delivering Messi the one major trophy that had eluded him. [...] Lionel Messi of Argentina celebrates with the World Cup trophy at the end of the FIFA World Cup Qatar 2022 Final match between Argentina and France at Lusail Stadium on December 18, 2022 in Lusail City, Qatar. (Photo by Chris Brunskill/Fantasista/Get Expand The final featured multiple momentum swings, a hat trick from France\u2019s Kylian Mbapp\u00e9 and goals from Messi at crucial moments \u2014 elements that led many fans and analysts to call it one of the greatest World Cup finals in history. ## Argentina\u2019s historic win The 2022 championship gave Argentina its third World Cup, joining previous titles won in: 1978 1986 The win also cemented Lionel Messi\u2019s legacy as one of the sport\u2019s all-time greats, marking the pinnacle of his international career.\n\n### 5. Argentina wins the World Cup, Messi's first - History.com (Credibility Score: 0.5)\nURL: https://www.history.com/this-day-in-history/december-18/argentina-messi-2022-world-cup-win\nSnippet: December | | | | | | | | --- --- --- | | | | | | | | | | | | | | | | | | | | | | | | | | | | | | | | | | | | | | | | By: HISTORY.com Editors 2022 # Argentina wins the World Cup, Messi\u2019s first The final came down to a dramatic penalty shootout. HISTORY.com Editors Offside via Getty Images Published: December 12, 2025Last On December 18, 2022, Argentina defeats France in the World Cup soccer final in Qatar. It is the first, and long-awaited, World Cup victory for Lionel Messi, Argentina\u2019s 35-year-old superstar forward. [...] The 2022 final pitted Argentina, led by the veteran Messi, against France and their 23-year-old star, Kylian Mbapp\u00e9. The host stadium in Doha was packed with Argentina fans hoping to witness a career-capping victory for their team\u2019s captain. Fans expecting a goal-scoring duel between Messi and Mbapp\u00e9 were not disappointed\u2014but they had to wait until late in the match.\n",
      "token_estimate": 2056,
      "cached": false
    },
    "heuristic_score": 0.7,
    "llm_score": 0.0,
    "llm_reasoning": "API Error: 402",
    "credibility_score": 0.0,
    "credibility_reasoning": "API Error: 402"
  },
  {
    "id": 3,
    "query": "Compare the architecture of React vs Vue for enterprise apps",
    "status": "success",
    "latency": 2.241244077682495,
    "result_count": 5,
    "data": {
      "query": "Compare the architecture of React vs Vue for enterprise apps",
      "ai_overview": "React offers flexible, modular architecture ideal for large enterprise apps, while Vue provides a more opinionated, simpler structure suited for mid-sized projects. React's extensive ecosystem supports complex scalability, whereas Vue's two-way data binding and built-in tools are beginner-friendly.",
      "organic_results": [
        {
          "title": "React vs Vue vs Angular for Enterprise Applications - Coder Trove",
          "url": "https://www.codertrove.com/articles/2025-tech-stack-dilemma-react-vs-vue-vs-angular-for-enterprise-application",
          "snippet": "Vue: Performs well in smaller-to-mid projects. Lightweight reactivity system enables faster rendering than Angular. May need extra tuning for large-scale apps. Angular: Performs well in large apps with AOT compilation and tree shaking. Built-in tools increase initial load time but optimise for complex enterprise applications. ### 3. Scalability React: Scales excellently for small and large applications. Modular component architecture. Flexibility allows choosing libraries for state, routing, etc. Vue: Excellent scalability for small-to-medium projects. Reactive binding and component system manage growing apps easily. Integrates with Vuex/Pinia for larger projects. [...] Angular: Designed for large-scale applications. Modules, dependency injection, and two-way binding provide efficient code management across large teams. ### 4. Architecture React: Flexible, minimalistic view layer approach. Developers choose tools (Redux for state, React Router for routing). Ideal for tailored architecture, but requires guidelines for consistency. Vue: Similar to React but more opinionated. Component-based with built-in Vuex/Pinia (state) and Vue Router. More structured than React, lighter than Angular. Angular: Comprehensive, opinionated architecture. Includes dependency injection, RxJS, modular structure. Provides consistency across large teams, but is less flexible. ### 5. Ecosystem [...] ### ### #1 Rendering React: Uses Virtual DOM, optimises rendering by updating only changed UI parts. Ideal for complex apps with frequent updates. Vue: Also uses Virtual DOM with reactive data-binding. Automatically tracks component dependencies and updates only necessary components. Better performance in small to mid-sized apps. Angular: Uses Real DOM, requires full page re-render unless optimised. OnPush change detection helps, but can be slow in large apps without careful optimisation. ### 2. Performance React: Highly optimised with memoization, lazy loading, and concurrent rendering. Best for fine control over rendering in dynamic UIs.",
          "score": 0.5,
          "embedding": null
        },
        {
          "title": "Vue vs React: Choosing the Best Framework for Your Next Project",
          "url": "https://www.monterail.com/blog/vue-vs-react",
          "snippet": "3Vue vs React Differences and Detailed Comparison > Vue.js and React are both great tools for building interactive user interfaces. Choosing between them for your project will usually come down to whether you have Vue or React specialists available. Beyond that, as a rule of thumb, Vue.js might be better for smaller projects or teams seeking simplicity and rapid development, thanks to beginner-friendly syntax and streamlined architecture. React could be the better choice for complex enterprise appliations, thanks to its robust ecosystem and enterprise-grade scalability. [...] ## Choosing the Right Framework for Your Project Vue.js and React are both great tools for building interactive user interfaces. To choose which is better for your next project, you have to consider several factors, including your specific use case, your business needs, environment, developer availability, budget, and the timeframe you\u2019re working with. For smaller projects or teams seeking simplicity and rapid development, Vue.js shines with its beginner-friendly syntax and streamlined architecture. On the other hand, React.js, with its robust ecosystem and enterprise-grade scalability, is better suited for complex, high-performance applications. [...] Progressive Web Apps (PWAs): Vue.js is also highly effective for creating Progressive Web Apps (PWAs), which provide native-like functionality while accessible via web browsers. With its lightweight design and quick performance, Vue.js helps enterprises improve user engagement without the need for developing separate mobile apps, offering a seamless experience across devices. What about React.js? Since React was created with large-scale Web projects in mind, choosing it for small and simple apps might be overkill. Although it requires a lot of boilerplate code to set up a working project, React\u2019s architecture ultimately pays off in the long run.",
          "score": 0.5,
          "embedding": null
        },
        {
          "title": "Vue vs React: Which Framework To Choose? - Software Mind",
          "url": "https://softwaremind.com/blog/vue-vs-react-a-comprehensive-comparison-for-modern-development/",
          "snippet": "React and Vue represent two different approaches to scalability. React thrives in large-scale applications, thanks to its flexibility and extensive ecosystem. Developers can tailor their projects by integrating libraries for state management (e.g., Redux) and routing, allowing for detailed control over application behavior. React\u2019s architecture, combined with its strong community support, makes it an excellent choice for enterprise-grade projects or applications requiring long-term maintenance and frequent updates. [...] Why do people use React over Vue? React is a powerful choice for teams tackling large, complex applications that demand scalability and flexibility. Its extensive ecosystem allows developers to pick the tools they need for tasks like state management, routing, or server-side rendering, enabling highly customized solutions. React\u2019s component-based architecture and JSX syntax give developers unmatched control over their codebase, making it ideal for enterprise-level projects or applications that need to adapt and grow over time.",
          "score": 0.5,
          "embedding": null
        },
        {
          "title": "Vue vs React: A Detailed Business Comparison - Naturaily",
          "url": "https://naturaily.com/blog/vue-vs-react",
          "snippet": "The React library doesn't have a built-in architecture pattern- it is built on components and it's the interaction between the users' actions and the state of the application components that creates the architecture of React.js. For building advanced apllications with a defined architecture pattern, React needs to be completed by external libraries, such as Redux, Flux, MobX, and Reflux. Vue\u2019s architecture and DOM structures are divided into two parts \u2013 filters and directives. Vue, otherwise than in the case of React, where there is only a one-way data flow, offers two-way data binding, which allows developers to apply classes, change styles and apply values to HTML. [...] Vue\u2019s tools and libraries, on the other hand, are mainly developed by its core team, and community-based solutions are just an addition. Vue is more balanced when it comes to the proportion of third-party and pre-built tools, so it\u2019s friendly for newbies. ### React vs Vue - Performance & Speed React\u2019s performance is great because the component-based architecture helps build smart single-page apps with clean code and speedy page loading. The changes on the website may appear without the need to reload everything, so the web apps provide their users with seamless and pleasing user experiences. On the other hand, Vue\u2019s virtual DOM helps in optimizing the performance, and lazy loading improves the load time. [...] On the other hand, React, unlike Vue, doesn\u2019t contain official packages for routing or state management, so developers who want to build complex apps have to use third-party solutions, but luckily there\u2019s an abundance of them. ### Scalability, Flexibility & Reusability Scalability: React vs Vue React is an excellent technology to build scalable UIs thanks to its use of pure JavaScript and component reusability. React\u2019s component-based architecture allows developers to create reusable parent and child components, making it easier to build complex user interfaces by breaking them down into smaller, more manageable pieces. React is also lightweight enough to be used in multi-page apps or big single-page apps.",
          "score": 0.5,
          "embedding": null
        },
        {
          "title": "React vs Vue: Which Framework Is Best for Your Project in 2025?",
          "url": "https://wavenest.ai/2025/11/14/react-vs-vue-best-framework-2025/",
          "snippet": "#### 1. React vs Vue in 2025 JavaScript frameworks continue evolving at lightning speed, but a key trend remains constant: businesses want fast, maintainable, and scalable apps. React and Vue have proven their reliability. Here\u2019s how they stand in 2025: React holds the highest adoption rate among enterprises and large-scale applications. Vue leads in developer satisfaction, simplicity, and ease of onboarding for beginners. Both frameworks now support advanced features like server-side rendering, type safety, and reactive architectures. According to recent developer surveys: [...] #### 12. React vs Vue: Scalability Scalability is a critical factor for choosing a framework, especially when planning applications that are expected to grow in size, complexity, or user base. Both React and Vue support scalable architectures, but they differ in approach and suitability. ##### React Scalability Ideal for large, complex applications Better suited for multi-team development Flexible architecture allows enterprise structure Strong TypeScript ecosystem ##### Vue Scalability Great scalability for mid-size apps Supports modular architecture with Vue 3 Nuxt improves structure for larger apps React scales more naturally due to: More libraries Community patterns Corporate adoption #### 13. React vs Vue Comparison Table (2025) [...] #### React vs Vue Choosing the right framework for your project in 2025 is crucial for long-term success. React is ideal for enterprise-grade applications, large teams, and projects requiring maximum flexibility, while Vue is perfect for startups, mid-sized apps, and rapid development with a simpler learning curve. Both frameworks are mature, performant, and capable of delivering modern, interactive web applications. At Wavenest, we specialize in building scalable, API-driven applications using React and Vue, tailored to your business needs. Whether you\u2019re launching a startup MVP or a complex enterprise platform, our expert team ensures efficient development and a seamless user experience.",
          "score": 0.5,
          "embedding": null
        }
      ],
      "formatted_output": "# Search Results for: Compare the architecture of React vs Vue for enterprise apps\n\n## AI Overview\nReact offers flexible, modular architecture ideal for large enterprise apps, while Vue provides a more opinionated, simpler structure suited for mid-sized projects. React's extensive ecosystem supports complex scalability, whereas Vue's two-way data binding and built-in tools are beginner-friendly.\n\n---\n\n### 1. React vs Vue vs Angular for Enterprise Applications - Coder Trove (Credibility Score: 0.5)\nURL: https://www.codertrove.com/articles/2025-tech-stack-dilemma-react-vs-vue-vs-angular-for-enterprise-application\nSnippet: Vue: Performs well in smaller-to-mid projects. Lightweight reactivity system enables faster rendering than Angular. May need extra tuning for large-scale apps. Angular: Performs well in large apps with AOT compilation and tree shaking. Built-in tools increase initial load time but optimise for complex enterprise applications. ### 3. Scalability React: Scales excellently for small and large applications. Modular component architecture. Flexibility allows choosing libraries for state, routing, etc. Vue: Excellent scalability for small-to-medium projects. Reactive binding and component system manage growing apps easily. Integrates with Vuex/Pinia for larger projects. [...] Angular: Designed for large-scale applications. Modules, dependency injection, and two-way binding provide efficient code management across large teams. ### 4. Architecture React: Flexible, minimalistic view layer approach. Developers choose tools (Redux for state, React Router for routing). Ideal for tailored architecture, but requires guidelines for consistency. Vue: Similar to React but more opinionated. Component-based with built-in Vuex/Pinia (state) and Vue Router. More structured than React, lighter than Angular. Angular: Comprehensive, opinionated architecture. Includes dependency injection, RxJS, modular structure. Provides consistency across large teams, but is less flexible. ### 5. Ecosystem [...] ### ### #1 Rendering React: Uses Virtual DOM, optimises rendering by updating only changed UI parts. Ideal for complex apps with frequent updates. Vue: Also uses Virtual DOM with reactive data-binding. Automatically tracks component dependencies and updates only necessary components. Better performance in small to mid-sized apps. Angular: Uses Real DOM, requires full page re-render unless optimised. OnPush change detection helps, but can be slow in large apps without careful optimisation. ### 2. Performance React: Highly optimised with memoization, lazy loading, and concurrent rendering. Best for fine control over rendering in dynamic UIs.\n\n### 2. Vue vs React: Choosing the Best Framework for Your Next Project (Credibility Score: 0.5)\nURL: https://www.monterail.com/blog/vue-vs-react\nSnippet: 3Vue vs React Differences and Detailed Comparison > Vue.js and React are both great tools for building interactive user interfaces. Choosing between them for your project will usually come down to whether you have Vue or React specialists available. Beyond that, as a rule of thumb, Vue.js might be better for smaller projects or teams seeking simplicity and rapid development, thanks to beginner-friendly syntax and streamlined architecture. React could be the better choice for complex enterprise appliations, thanks to its robust ecosystem and enterprise-grade scalability. [...] ## Choosing the Right Framework for Your Project Vue.js and React are both great tools for building interactive user interfaces. To choose which is better for your next project, you have to consider several factors, including your specific use case, your business needs, environment, developer availability, budget, and the timeframe you\u2019re working with. For smaller projects or teams seeking simplicity and rapid development, Vue.js shines with its beginner-friendly syntax and streamlined architecture. On the other hand, React.js, with its robust ecosystem and enterprise-grade scalability, is better suited for complex, high-performance applications. [...] Progressive Web Apps (PWAs): Vue.js is also highly effective for creating Progressive Web Apps (PWAs), which provide native-like functionality while accessible via web browsers. With its lightweight design and quick performance, Vue.js helps enterprises improve user engagement without the need for developing separate mobile apps, offering a seamless experience across devices. What about React.js? Since React was created with large-scale Web projects in mind, choosing it for small and simple apps might be overkill. Although it requires a lot of boilerplate code to set up a working project, React\u2019s architecture ultimately pays off in the long run.\n\n### 3. Vue vs React: Which Framework To Choose? - Software Mind (Credibility Score: 0.5)\nURL: https://softwaremind.com/blog/vue-vs-react-a-comprehensive-comparison-for-modern-development/\nSnippet: React and Vue represent two different approaches to scalability. React thrives in large-scale applications, thanks to its flexibility and extensive ecosystem. Developers can tailor their projects by integrating libraries for state management (e.g., Redux) and routing, allowing for detailed control over application behavior. React\u2019s architecture, combined with its strong community support, makes it an excellent choice for enterprise-grade projects or applications requiring long-term maintenance and frequent updates. [...] Why do people use React over Vue? React is a powerful choice for teams tackling large, complex applications that demand scalability and flexibility. Its extensive ecosystem allows developers to pick the tools they need for tasks like state management, routing, or server-side rendering, enabling highly customized solutions. React\u2019s component-based architecture and JSX syntax give developers unmatched control over their codebase, making it ideal for enterprise-level projects or applications that need to adapt and grow over time.\n\n### 4. Vue vs React: A Detailed Business Comparison - Naturaily (Credibility Score: 0.5)\nURL: https://naturaily.com/blog/vue-vs-react\nSnippet: The React library doesn't have a built-in architecture pattern- it is built on components and it's the interaction between the users' actions and the state of the application components that creates the architecture of React.js. For building advanced apllications with a defined architecture pattern, React needs to be completed by external libraries, such as Redux, Flux, MobX, and Reflux. Vue\u2019s architecture and DOM structures are divided into two parts \u2013 filters and directives. Vue, otherwise than in the case of React, where there is only a one-way data flow, offers two-way data binding, which allows developers to apply classes, change styles and apply values to HTML. [...] Vue\u2019s tools and libraries, on the other hand, are mainly developed by its core team, and community-based solutions are just an addition. Vue is more balanced when it comes to the proportion of third-party and pre-built tools, so it\u2019s friendly for newbies. ### React vs Vue - Performance & Speed React\u2019s performance is great because the component-based architecture helps build smart single-page apps with clean code and speedy page loading. The changes on the website may appear without the need to reload everything, so the web apps provide their users with seamless and pleasing user experiences. On the other hand, Vue\u2019s virtual DOM helps in optimizing the performance, and lazy loading improves the load time. [...] On the other hand, React, unlike Vue, doesn\u2019t contain official packages for routing or state management, so developers who want to build complex apps have to use third-party solutions, but luckily there\u2019s an abundance of them. ### Scalability, Flexibility & Reusability Scalability: React vs Vue React is an excellent technology to build scalable UIs thanks to its use of pure JavaScript and component reusability. React\u2019s component-based architecture allows developers to create reusable parent and child components, making it easier to build complex user interfaces by breaking them down into smaller, more manageable pieces. React is also lightweight enough to be used in multi-page apps or big single-page apps.\n\n### 5. React vs Vue: Which Framework Is Best for Your Project in 2025? (Credibility Score: 0.5)\nURL: https://wavenest.ai/2025/11/14/react-vs-vue-best-framework-2025/\nSnippet: #### 1. React vs Vue in 2025 JavaScript frameworks continue evolving at lightning speed, but a key trend remains constant: businesses want fast, maintainable, and scalable apps. React and Vue have proven their reliability. Here\u2019s how they stand in 2025: React holds the highest adoption rate among enterprises and large-scale applications. Vue leads in developer satisfaction, simplicity, and ease of onboarding for beginners. Both frameworks now support advanced features like server-side rendering, type safety, and reactive architectures. According to recent developer surveys: [...] #### 12. React vs Vue: Scalability Scalability is a critical factor for choosing a framework, especially when planning applications that are expected to grow in size, complexity, or user base. Both React and Vue support scalable architectures, but they differ in approach and suitability. ##### React Scalability Ideal for large, complex applications Better suited for multi-team development Flexible architecture allows enterprise structure Strong TypeScript ecosystem ##### Vue Scalability Great scalability for mid-size apps Supports modular architecture with Vue 3 Nuxt improves structure for larger apps React scales more naturally due to: More libraries Community patterns Corporate adoption #### 13. React vs Vue Comparison Table (2025) [...] #### React vs Vue Choosing the right framework for your project in 2025 is crucial for long-term success. React is ideal for enterprise-grade applications, large teams, and projects requiring maximum flexibility, while Vue is perfect for startups, mid-sized apps, and rapid development with a simpler learning curve. Both frameworks are mature, performant, and capable of delivering modern, interactive web applications. At Wavenest, we specialize in building scalable, API-driven applications using React and Vue, tailored to your business needs. Whether you\u2019re launching a startup MVP or a complex enterprise platform, our expert team ensures efficient development and a seamless user experience.\n",
      "token_estimate": 1899,
      "cached": false
    },
    "heuristic_score": 0.8200000000000001,
    "llm_score": 0.0,
    "llm_reasoning": "API Error: 402",
    "credibility_score": 0.0,
    "credibility_reasoning": "API Error: 402"
  },
  {
    "id": 4,
    "query": "How to center a div in CSS using flexbox",
    "status": "success",
    "latency": 2.2108983993530273,
    "result_count": 5,
    "data": {
      "query": "How to center a div in CSS using flexbox",
      "ai_overview": "To center a div using flexbox, set the parent's display to flex, justify-content to center, and align-items to center. This centers the child div both horizontally and vertically.",
      "organic_results": [
        {
          "title": "How To Center a Div - Josh W. Comeau",
          "url": "https://www.joshwcomeau.com/css/center-a-div/",
          "snippet": "## Link to this headingCentering with Flexbox Flexbox is designed to give us a ton of control when it comes to distributing a group of items along a primary axis. It offers some really powerful tools for centering! Let's start by centering a single element, both horizontally and vertically: 100% 100% ``` .container {. container { display: flex; display: flex; justify-content: center; justify-content: center; align-items: center; align-items: center;}} ``` .element The really cool thing about Flexbox centering is that it works even when the children don\u2019t fit in their container! Try shrinking the width/height, and notice that the element overflows symmetrically. It also works for multiple children. We can control how they stack with the `flex-direction` property: [...] Here's the deal: the child element is given `width: 50%` and `height: 50%`. In Flexbox, these percentages are calculated based on the parent element, `.container`, which is what we want. In CSS Grid, however, the percentages are relative to the grid cell. We're saying that the child element should be 50% as wide as its column, and 50% as tall as its row. Now, we haven't actually given the row/column an explicit size; we haven't defined `grid-template-columns` or `grid-template-rows`. When we omit this information, the grid tracks will calculate their size based on their contents, shrinkwrapping around whatever is in each row/column. The end result is that our grid cell is the same size as `.element`\u2019s original size, and then the element shrinks to 50% of that grid cell: 50% 50% [...] If we want to horizontally center a single element without disturbing any of its siblings, we can use the Flow layout auto margin strategy. If we have a piece of floating UI, like a modal or a banner, we can center it using Positioned layout and auto margins. If we want to center a stack of elements one on top of the other, we can use CSS Grid. If we want to center text, we can use text-align. This can be used in conjunction with any of the additional methods. Finally, in most other situations, we can use Flexbox. It's the most versatile method; it can be used to center one or multiple children, horizontally and/or vertically, whether they're contained or overflowing.",
          "score": 0.5,
          "embedding": null
        },
        {
          "title": "Flexbox: center horizontally and vertically - Stack Overflow",
          "url": "https://stackoverflow.com/questions/19026884/flexbox-center-horizontally-and-vertically",
          "snippet": "Below are two general centering solutions. One for vertically-aligned flex items (`flex-direction: column`) and the other for horizontally-aligned flex items (`flex-direction: row`). In both cases the height of the centered divs can be variable, undefined, unknown, whatever. The height of the centered divs doesn't matter. Here's the HTML for both: ``` DIV #1 DIV #2 ``` CSS (excluding decorative styles) When flex items are stacked vertically: ``` #container { display: flex; / establish flex container / flex-direction: column; / make main axis vertical / justify-content: center; / center items vertically, in this case / align-items: center; / center items horizontally, in this case / height: 300px; } .box { width: 300px; margin: 5px; text-align: center; / will center text in [...] ``` something ``` Share Improve this answer edited Jan 27, 2022 at 10:06 answered Aug 26, 2021 at 17:46 Hari Kishore 2,99033 gold badges2727 silver badges3333 bronze badges ## Comments 16 1 - Set CSS on parent div to `display: flex;` 2 - Set CSS on parent div to `flex-direction: column;` Note that this will make all content within that div line up top to bottom. This will work best if the parent div only contains the child and nothing else. 3 - Set CSS on parent div to `justify-content: center;` Here is an example of what the CSS will look like: ``` .parentDivClass { display: flex; flex-direction: column; justify-content: center; } ``` Share Improve this answer answered Feb 25, 2018 at 22:05 MelanieP 32933 silver badges55 bronze badges ## Comments 12 [...] 32933 silver badges55 bronze badges ## Comments 12 `diplay: flex;` for it's container and `margin:auto;` for it's item works perfect. NOTE: You have to setup the `width` and `height` to see the effect. ``` #container{ width: 100%; /width needs to be setup/ height: 150px; /height needs to be setup/ display: flex; } .item{ margin: auto; /These will make the item in center/ background-color: #CCC; } ``` ``` CENTER ``` Share Improve this answer answered Nov 13, 2018 at 2:27 Polar 3,58755 gold badges5353 silver badges8383 bronze badges ## Comments 5 `margin: auto` works \"perfectly\" with flexbox i.e. it allows to center item vertically and horizontally.",
          "score": 0.75,
          "embedding": null
        },
        {
          "title": "Aligning items in a flex container - CSS - MDN Web Docs",
          "url": "https://developer.mozilla.org/en-US/docs/Web/CSS/Guides/Flexible_box_layout/Aligning_items",
          "snippet": "## Using alignment in flexbox Flexbox provides several properties to control alignment and spacing, with `align-items` and `justify-content` being fundamental for centering elements. To center an element, we use the `align-items` property to align the item on the cross axis, which in this case is the block axis running vertically. We use `justify-content` to align the item on the main axis, which in this case is the inline axis running horizontally. Change the size of the container or nested element in the code example below. The nested element always remains centered. html css [...] In this next live example, the flex container has `align-items: flex-start`, which means the items are all aligned to the start of the cross axis. Using the `first-child` selector, the first item is set to `align-self: stretch`. Another item with the `selected` class has `align-self: center` set. Change the value of `align-items` or change the values of `align-self` on the individual items to see how this works. html ``` One Two Three Four ``` css ``` .box { border: 2px dotted rgb(96 139 168); display: flex; align-items: flex-start; height: 200px; } .box div { background-color: rgb(96 139 168 / 0.2); border: 2px solid rgb(96 139 168); border-radius: 5px; padding: 20px; } .box > :first-child { align-self: stretch; } .box .selected { align-self: center; } ``` [...] html css ``` .box { display: flex; align-items: center; justify-content: center; border: 2px dotted rgb(96 139 168); } .box div { width: 100px; height: 100px; border: 2px solid rgb(96 139 168); border-radius: 5px; background-color: rgb(96 139 168 / 0.2); } ``` ## Properties for controlling alignment in flexbox The properties we will look at in this guide are as follows. `justify-content`: Controls the alignment of all items on the main axis. `align-items`: Controls the alignment of all items on the cross axis. `align-self`: Controls the alignment of an individual flex item on the cross axis. `align-content`: Controls the space between flex lines on the cross axis. `gap`, `column-gap`, and `row-gap`: Used to create gaps or gutters between flex items.",
          "score": 0.85,
          "embedding": null
        },
        {
          "title": "CSS Center Align - W3Schools",
          "url": "https://www.w3schools.com/css/css_align.asp",
          "snippet": "Try it Yourself \u00bb ## Center Align with Flexbox With CSS flexbox you can center elements, both horizontally and vertically, within a flex container. A flex container with both the `justify-content` and the `align-items` properties set to `center` will align the item(s) in the center (in both axis): I am vertically and horizontally centered. ### Example .center { display: flex; justify-content: center; align-items: center; height: 200px; border: 3px solid green; } Try it Yourself \u00bb ## Center Align with Grid With CSS grid you can center elements, both horizontally and vertically, within a grid container. A grid container with the `place-items` property set to center, will align the item(s) in the center (in both axis). [...] This div element is centered. ### Example .center { margin: auto; width: 50%; border: 3px solid green; padding: 10px; } Try it Yourself \u00bb ## Center Align Text To center the text inside a block-level element, use `text-align: center;`. This text is centered. ### Example p { text-align: center; } Try it Yourself \u00bb Tip: For more examples on how to align text, see the CSS Text chapter. --- ## Center Align an Image To center an image, set `margin-left` and `margin-right` to `auto`, and also turn the image into a `block` element: ### Example img { display: block; margin-left: auto; margin-right: auto; width: 40%; } Try it Yourself \u00bb ## Center Align with Flexbox [...] # CSS Horizontal & Vertical Align \u276e Previous Next \u276f ## Center elements horizontally and vertically ## CSS Centering Elements With CSS, you can center elements (horizontally, vertically, or both) with several methods, depending on the type of element. ## Center Align Block Elements Use `margin: auto;`, to horizontally center a block-level element (like ). Also specify a `width` for the element, to prevent it from stretching out to the edges of its container. Note: Center aligning has no effect on block-level elements if the `width` property is not set (or set to 100%). Below, the element is centered and has a width of 50% (and the remaining space will be split equally between the left and right margins): This div element is centered.",
          "score": 0.5,
          "embedding": null
        },
        {
          "title": "justify-content - CSS - MDN Web Docs",
          "url": "https://developer.mozilla.org/en-US/docs/Web/CSS/Reference/Properties/justify-content",
          "snippet": "css ``` .container { align-items: baseline; display: flex; width: 350px; height: 2em; } .safe { justify-content: center; } .safe-center { justify-content: safe center; } div { flex: 0 0 100px; } ``` #### Result As an item overflows the alignment container, with safe included the alignment mode behaves as start and the center alignment is not implemented. The safe keyterm has no effect if the items do not overflow the container. ### Visualizing flex item distribution This example includes a multi-line wrapping flex layout. The second flex item has a positive flex growth factor, consuming all the available free space in the first flex line. #### CSS [...] `center` : The items are packed flush to each other toward the center of the alignment container along the main axis. `left` : The items are packed flush to each other toward the left edge of the alignment container. When the property's horizontal axis is not parallel with the inline axis, such as when `flex-direction: column;` is set, this value behaves like `start`. `right` : The items are packed flush to each other toward the right edge of the alignment container in the appropriate axis. If the property's axis is not parallel with the inline axis (in a grid container) or the main-axis (in a flexbox container), this value behaves like `start`. [...",
          "score": 0.85,
          "embedding": null
        }
      ],
      "formatted_output": "# Search Results for: How to center a div in CSS using flexbox\n\n## AI Overview\nTo center a div using flexbox, set the parent's display to flex, justify-content to center, and align-items to center. This centers the child div both horizontally and vertically.\n\n---\n\n### 1. Aligning items in a flex container - CSS - MDN Web Docs (Credibility Score: 0.85)\nURL: https://developer.mozilla.org/en-US/docs/Web/CSS/Guides/Flexible_box_layout/Aligning_items\nSnippet: ## Using alignment in flexbox Flexbox provides several properties to control alignment and spacing, with `align-items` and `justify-content` being fundamental for centering elements. To center an element, we use the `align-items` property to align the item on the cross axis, which in this case is the block axis running vertically. We use `justify-content` to align the item on the main axis, which in this case is the inline axis running horizontally. Change the size of the container or nested element in the code example below. The nested element always remains centered. html css [...] In this next live example, the flex container has `align-items: flex-start`, which means the items are all aligned to the start of the cross axis. Using the `first-child` selector, the first item is set to `align-self: stretch`. Another item with the `selected` class has `align-self: center` set. Change the value of `align-items` or change the values of `align-self` on the individual items to see how this works. html ``` One Two Three Four ``` css ``` .box { border: 2px dotted rgb(96 139 168); display: flex; align-items: flex-start; height: 200px; } .box div { background-color: rgb(96 139 168 / 0.2); border: 2px solid rgb(96 139 168); border-radius: 5px; padding: 20px; } .box > :first-child { align-self: stretch; } .box .selected { align-self: center; } ``` [...] html css ``` .box { display: flex; align-items: center; justify-content: center; border: 2px dotted rgb(96 139 168); } .box div { width: 100px; height: 100px; border: 2px solid rgb(96 139 168); border-radius: 5px; background-color: rgb(96 139 168 / 0.2); } ``` ## Properties for controlling alignment in flexbox The properties we will look at in this guide are as follows. `justify-content`: Controls the alignment of all items on the main axis. `align-items`: Controls the alignment of all items on the cross axis. `align-self`: Controls the alignment of an individual flex item on the cross axis. `align-content`: Controls the space between flex lines on the cross axis. `gap`, `column-gap`, and `row-gap`: Used to create gaps or gutters between flex items.\n\n### 2. justify-content - CSS - MDN Web Docs (Credibility Score: 0.85)\nURL: https://developer.mozilla.org/en-US/docs/Web/CSS/Reference/Properties/justify-content\nSnippet: css ``` .container { align-items: baseline; display: flex; width: 350px; height: 2em; } .safe { justify-content: center; } .safe-center { justify-content: safe center; } div { flex: 0 0 100px; } ``` #### Result As an item overflows the alignment container, with safe included the alignment mode behaves as start and the center alignment is not implemented. The safe keyterm has no effect if the items do not overflow the container. ### Visualizing flex item distribution This example includes a multi-line wrapping flex layout. The second flex item has a positive flex growth factor, consuming all the available free space in the first flex line. #### CSS [...] `center` : The items are packed flush to each other toward the center of the alignment container along the main axis. `left` : The items are packed flush to each other toward the left edge of the alignment container. When the property's horizontal axis is not parallel with the inline axis, such as when `flex-direction: column;` is set, this value behaves like `start`. `right` : The items are packed flush to each other toward the right edge of the alignment container in the appropriate axis. If the property's axis is not parallel with the inline axis (in a grid container) or the main-axis (in a flexbox container), this value behaves like `start`. [...\n\n### 3. Flexbox: center horizontally and vertically - Stack Overflow (Credibility Score: 0.75)\nURL: https://stackoverflow.com/questions/19026884/flexbox-center-horizontally-and-vertically\nSnippet: Below are two general centering solutions. One for vertically-aligned flex items (`flex-direction: column`) and the other for horizontally-aligned flex items (`flex-direction: row`). In both cases the height of the centered divs can be variable, undefined, unknown, whatever. The height of the centered divs doesn't matter. Here's the HTML for both: ``` DIV #1 DIV #2 ``` CSS (excluding decorative styles) When flex items are stacked vertically: ``` #container { display: flex; / establish flex container / flex-direction: column; / make main axis vertical / justify-content: center; / center items vertically, in this case / align-items: center; / center items horizontally, in this case / height: 300px; } .box { width: 300px; margin: 5px; text-align: center; / will center text in [...] ``` something ``` Share Improve this answer edited Jan 27, 2022 at 10:06 answered Aug 26, 2021 at 17:46 Hari Kishore 2,99033 gold badges2727 silver badges3333 bronze badges ## Comments 16 1 - Set CSS on parent div to `display: flex;` 2 - Set CSS on parent div to `flex-direction: column;` Note that this will make all content within that div line up top to bottom. This will work best if the parent div only contains the child and nothing else. 3 - Set CSS on parent div to `justify-content: center;` Here is an example of what the CSS will look like: ``` .parentDivClass { display: flex; flex-direction: column; justify-content: center; } ``` Share Improve this answer answered Feb 25, 2018 at 22:05 MelanieP 32933 silver badges55 bronze badges ## Comments 12 [...] 32933 silver badges55 bronze badges ## Comments 12 `diplay: flex;` for it's container and `margin:auto;` for it's item works perfect. NOTE: You have to setup the `width` and `height` to see the effect. ``` #container{ width: 100%; /width needs to be setup/ height: 150px; /height needs to be setup/ display: flex; } .item{ margin: auto; /These will make the item in center/ background-color: #CCC; } ``` ``` CENTER ``` Share Improve this answer answered Nov 13, 2018 at 2:27 Polar 3,58755 gold badges5353 silver badges8383 bronze badges ## Comments 5 `margin: auto` works \"perfectly\" with flexbox i.e. it allows to center item vertically and horizontally.\n\n### 4. How To Center a Div - Josh W. Comeau (Credibility Score: 0.5)\nURL: https://www.joshwcomeau.com/css/center-a-div/\nSnippet: ## Link to this headingCentering with Flexbox Flexbox is designed to give us a ton of control when it comes to distributing a group of items along a primary axis. It offers some really powerful tools for centering! Let's start by centering a single element, both horizontally and vertically: 100% 100% ``` .container {. container { display: flex; display: flex; justify-content: center; justify-content: center; align-items: center; align-items: center;}} ``` .element The really cool thing about Flexbox centering is that it works even when the children don\u2019t fit in their container! Try shrinking the width/height, and notice that the element overflows symmetrically. It also works for multiple children. We can control how they stack with the `flex-direction` property: [...] Here's the deal: the child element is given `width: 50%` and `height: 50%`. In Flexbox, these percentages are calculated based on the parent element, `.container`, which is what we want. In CSS Grid, however, the percentages are relative to the grid cell. We're saying that the child element should be 50% as wide as its column, and 50% as tall as its row. Now, we haven't actually given the row/column an explicit size; we haven't defined `grid-template-columns` or `grid-template-rows`. When we omit this information, the grid tracks will calculate their size based on their contents, shrinkwrapping around whatever is in each row/column. The end result is that our grid cell is the same size as `.element`\u2019s original size, and then the element shrinks to 50% of that grid cell: 50% 50% [...] If we want to horizontally center a single element without disturbing any of its siblings, we can use the Flow layout auto margin strategy. If we have a piece of floating UI, like a modal or a banner, we can center it using Positioned layout and auto margins. If we want to center a stack of elements one on top of the other, we can use CSS Grid. If we want to center text, we can use text-align. This can be used in conjunction with any of the additional methods. Finally, in most other situations, we can use Flexbox. It's the most versatile method; it can be used to center one or multiple children, horizontally and/or vertically, whether they're contained or overflowing.\n\n### 5. CSS Center Align - W3Schools (Credibility Score: 0.5)\nURL: https://www.w3schools.com/css/css_align.asp\nSnippet: Try it Yourself \u00bb ## Center Align with Flexbox With CSS flexbox you can center elements, both horizontally and vertically, within a flex container. A flex container with both the `justify-content` and the `align-items` properties set to `center` will align the item(s) in the center (in both axis): I am vertically and horizontally centered. ### Example .center { display: flex; justify-content: center; align-items: center; height: 200px; border: 3px solid green; } Try it Yourself \u00bb ## Center Align with Grid With CSS grid you can center elements, both horizontally and vertically, within a grid container. A grid container with the `place-items` property set to center, will align the item(s) in the center (in both axis). [...] This div element is centered. ### Example .center { margin: auto; width: 50%; border: 3px solid green; padding: 10px; } Try it Yourself \u00bb ## Center Align Text To center the text inside a block-level element, use `text-align: center;`. This text is centered. ### Example p { text-align: center; } Try it Yourself \u00bb Tip: For more examples on how to align text, see the CSS Text chapter. --- ## Center Align an Image To center an image, set `margin-left` and `margin-right` to `auto`, and also turn the image into a `block` element: ### Example img { display: block; margin-left: auto; margin-right: auto; width: 40%; } Try it Yourself \u00bb ## Center Align with Flexbox [...] # CSS Horizontal & Vertical Align \u276e Previous Next \u276f ## Center elements horizontally and vertically ## CSS Centering Elements With CSS, you can center elements (horizontally, vertically, or both) with several methods, depending on the type of element. ## Center Align Block Elements Use `margin: auto;`, to horizontally center a block-level element (like ). Also specify a `width` for the element, to prevent it from stretching out to the edges of its container. Note: Center aligning has no effect on block-level elements if the `width` property is not set (or set to 100%). Below, the element is centered and has a width of 50% (and the remaining space will be split equally between the left and right margins): This div element is centered.\n",
      "token_estimate": 2304,
      "cached": false
    },
    "heuristic_score": 0.888888888888889,
    "llm_score": 0.0,
    "llm_reasoning": "API Error: 402",
    "credibility_score": 0.0,
    "credibility_reasoning": "API Error: 402"
  },
  {
    "id": 5,
    "query": "Latest developments in quantum computing 2025",
    "status": "success",
    "latency": 2.1813220977783203,
    "result_count": 5,
    "data": {
      "query": "Latest developments in quantum computing 2025",
      "ai_overview": "In 2025, quantum computing saw significant funding, breakthroughs in hardware, and a shift towards commercialization. Key advancements included room-temperature quantum communication and a surge in cloud-based quantum platforms. Nobel Prize in Physics recognized foundational work on superconducting quantum circuits.",
      "organic_results": [
        {
          "title": "Quantum Computing Trends in 2025: Data Reveals Hardware Bets ...",
          "url": "https://thequantuminsider.com/2025/12/29/quantum-computing-trends-in-2025-data-reveals-hardware-bets-cloud-growth-and-security-focus/",
          "snippet": "### Regional Competition Intensifies Across EMEA and APAC Geographically, 2025 data points to strong growth outside the traditional North American centers of quantum development. In Europe, the United Kingdom stands out for activity in trapped ion systems and quantum encryption, supported by a mix of public funding and private capital. Israel continues to attract investment in cloud software platforms and superconducting hardware, while France and Germany are emerging as hubs for hardware development and quantum sensing technologies. [...] Investment patterns in 2025 indicate that trapped ion and photonics architectures have emerged as the dominant focus for new quantum hardware funding. According to data from the intelligence platform, multiple funding rounds in the $1 billion range collectively have flowed into companies developing these photonic and trapped-ion systems, particularly in the United States and the United Kingdom. Backers include a mix of specialist technology investors and large strategic funds, signaling confidence that these approaches offer a clearer path to scale. [...] # Quantum Computing Trends in 2025: Data Reveals Hardware Bets, Cloud Growth And Security Focus 2025 quantum trends 2025 quantum trends Hub Hub Insider Brief 2025 may be looked at as a watershed year for the quantum industry. A surge of late-stage funding and partnerships reshapted the global quantum industry in 2025, with investors concentrating capital on specific hardware architectures, cloud software platforms and security technologies that promise nearer-term commercial returns, according to analysis from The Quantum Insider\u2019s Intelligence Platform.",
          "score": 0.5,
          "embedding": null
        },
        {
          "title": "Top quantum breakthroughs of 2025 | Network World",
          "url": "https://www.networkworld.com/article/4088709/top-quantum-breakthroughs-of-2025.html",
          "snippet": "Nvidia has leaned into this heavily. At the end of October, the company announced an open system architecture for coupling its GPUs with quantum processors to build quantum supercomputers. The new platform, called NVQLink, is also integrated with Nvidia\u2019s CUDA-Q quantum software platform. Partners include many of the top firms in the quantum computing industry, including Alice & Bob, Anyon Computing, Atom Computing, Diraq, Infleqtion, IonQ, IQM Quantum Computers, ORCA Computing, Oxford Quantum Circuits, Pasqal, Quandela, Quantinuum, Quantum Circuits Inc., Quantum Machines, Quantum Motion, QuEra, Rigetti, SEEQC and Silicon Quantum Computing \u2014 as well as quantum control system builders including Keysight Technologies, Quantum Machines, Qblox, QubiC and Zurich Instruments. [...] According to research from SpinQ, quantum computing companies raised $3.77 billion in equity funding during the first nine months of 2025 \u2014 nearly triple the $1.3 billion raised in all of 2024. There are also publicly-traded quantum computing firms, chief among them being Rigetti, IonQ, Quantum Computing and D-Wave, and their stock prices have been on a wild ride lately. According to Motley Fool, share prices have gone up by more than 3,000% over the past year. \u201cSuch significant financings reflect investor confidence in near-term commercialization milestones,\u201d says Yuval Boger, chief commercial officer at QuEra Computing. \u201cAnd they prompt vendors, customers and funding agencies to treat quantum technologies as entering a deployment phase rather than purely an R&D play.\u201d [...] Finally, to cap off a groundbreaking year for quantum computing, three scientists received the 2025 Nobel Prize in Physics for their work on superconducting quantum circuits. The work itself was done in the 1980s and showed that quantum effects can show up even in large-scale things \u2014 a super-cold superconducting circuit can effectively act as it was a single quantum object, as if it was a single atom or subatomic particle. The fact that they got the award this year shows how important this work has become to today\u2019s quantum computers and sensors. According to the Royal Swedish Academy of Sciences, which awards the prizes, these awards are given for \u201cachievements that have conferred the greatest benefit to humankind.",
          "score": 0.5,
          "embedding": null
        },
        {
          "title": "The Year of Quantum: From concept to reality in 2025",
          "url": "https://www.mckinsey.com/capabilities/tech-and-ai/our-insights/the-year-of-quantum-from-concept-to-reality-in-2025",
          "snippet": "Explore the latest advancements in quantum computing, sensing, and communication with our comprehensive Quantum Technology Monitor 2025.",
          "score": 0.5,
          "embedding": null
        },
        {
          "title": "Quantum computing: Expanding what's possible - NSF",
          "url": "https://www.nsf.gov/science-matters/quantum-computing-expanding-whats-possible",
          "snippet": "In 2025, research groups at two NSF Physics Frontiers Centers made significant strides: One group created a new system that can detect and",
          "score": 0.95,
          "embedding": null
        },
        {
          "title": "Scientists achieve breakthrough on quantum signaling",
          "url": "https://news.stanford.edu/stories/2025/12/quantum-communication-room-temperature-breakthrough-research",
          "snippet": "Researchers developed a room-temperature quantum communication device, removing the need for super-cooling and enhancing practical applications.",
          "score": 0.95,
          "embedding": null
        }
      ],
      "formatted_output": "# Search Results for: Latest developments in quantum computing 2025\n\n## AI Overview\nIn 2025, quantum computing saw significant funding, breakthroughs in hardware, and a shift towards commercialization. Key advancements included room-temperature quantum communication and a surge in cloud-based quantum platforms. Nobel Prize in Physics recognized foundational work on superconducting quantum circuits.\n\n---\n\n### 1. Quantum computing: Expanding what's possible - NSF (Credibility Score: 0.95)\nURL: https://www.nsf.gov/science-matters/quantum-computing-expanding-whats-possible\nSnippet: In 2025, research groups at two NSF Physics Frontiers Centers made significant strides: One group created a new system that can detect and\n\n### 2. Scientists achieve breakthrough on quantum signaling (Credibility Score: 0.95)\nURL: https://news.stanford.edu/stories/2025/12/quantum-communication-room-temperature-breakthrough-research\nSnippet: Researchers developed a room-temperature quantum communication device, removing the need for super-cooling and enhancing practical applications.\n\n### 3. Quantum Computing Trends in 2025: Data Reveals Hardware Bets ... (Credibility Score: 0.5)\nURL: https://thequantuminsider.com/2025/12/29/quantum-computing-trends-in-2025-data-reveals-hardware-bets-cloud-growth-and-security-focus/\nSnippet: ### Regional Competition Intensifies Across EMEA and APAC Geographically, 2025 data points to strong growth outside the traditional North American centers of quantum development. In Europe, the United Kingdom stands out for activity in trapped ion systems and quantum encryption, supported by a mix of public funding and private capital. Israel continues to attract investment in cloud software platforms and superconducting hardware, while France and Germany are emerging as hubs for hardware development and quantum sensing technologies. [...] Investment patterns in 2025 indicate that trapped ion and photonics architectures have emerged as the dominant focus for new quantum hardware funding. According to data from the intelligence platform, multiple funding rounds in the $1 billion range collectively have flowed into companies developing these photonic and trapped-ion systems, particularly in the United States and the United Kingdom. Backers include a mix of specialist technology investors and large strategic funds, signaling confidence that these approaches offer a clearer path to scale. [...] # Quantum Computing Trends in 2025: Data Reveals Hardware Bets, Cloud Growth And Security Focus 2025 quantum trends 2025 quantum trends Hub Hub Insider Brief 2025 may be looked at as a watershed year for the quantum industry. A surge of late-stage funding and partnerships reshapted the global quantum industry in 2025, with investors concentrating capital on specific hardware architectures, cloud software platforms and security technologies that promise nearer-term commercial returns, according to analysis from The Quantum Insider\u2019s Intelligence Platform.\n\n### 4. Top quantum breakthroughs of 2025 | Network World (Credibility Score: 0.5)\nURL: https://www.networkworld.com/article/4088709/top-quantum-breakthroughs-of-2025.html\nSnippet: Nvidia has leaned into this heavily. At the end of October, the company announced an open system architecture for coupling its GPUs with quantum processors to build quantum supercomputers. The new platform, called NVQLink, is also integrated with Nvidia\u2019s CUDA-Q quantum software platform. Partners include many of the top firms in the quantum computing industry, including Alice & Bob, Anyon Computing, Atom Computing, Diraq, Infleqtion, IonQ, IQM Quantum Computers, ORCA Computing, Oxford Quantum Circuits, Pasqal, Quandela, Quantinuum, Quantum Circuits Inc., Quantum Machines, Quantum Motion, QuEra, Rigetti, SEEQC and Silicon Quantum Computing \u2014 as well as quantum control system builders including Keysight Technologies, Quantum Machines, Qblox, QubiC and Zurich Instruments. [...] According to research from SpinQ, quantum computing companies raised $3.77 billion in equity funding during the first nine months of 2025 \u2014 nearly triple the $1.3 billion raised in all of 2024. There are also publicly-traded quantum computing firms, chief among them being Rigetti, IonQ, Quantum Computing and D-Wave, and their stock prices have been on a wild ride lately. According to Motley Fool, share prices have gone up by more than 3,000% over the past year. \u201cSuch significant financings reflect investor confidence in near-term commercialization milestones,\u201d says Yuval Boger, chief commercial officer at QuEra Computing. \u201cAnd they prompt vendors, customers and funding agencies to treat quantum technologies as entering a deployment phase rather than purely an R&D play.\u201d [...] Finally, to cap off a groundbreaking year for quantum computing, three scientists received the 2025 Nobel Prize in Physics for their work on superconducting quantum circuits. The work itself was done in the 1980s and showed that quantum effects can show up even in large-scale things \u2014 a super-cold superconducting circuit can effectively act as it was a single quantum object, as if it was a single atom or subatomic particle. The fact that they got the award this year shows how important this work has become to today\u2019s quantum computers and sensors. According to the Royal Swedish Academy of Sciences, which awards the prizes, these awards are given for \u201cachievements that have conferred the greatest benefit to humankind.\n\n### 5. The Year of Quantum: From concept to reality in 2025 (Credibility Score: 0.5)\nURL: https://www.mckinsey.com/capabilities/tech-and-ai/our-insights/the-year-of-quantum-from-concept-to-reality-in-2025\nSnippet: Explore the latest advancements in quantum computing, sensing, and communication with our comprehensive Quantum Technology Monitor 2025.\n",
      "token_estimate": 1011,
      "cached": false
    },
    "heuristic_score": 0.6333333333333333,
    "llm_score": 0.0,
    "llm_reasoning": "API Error: 402",
    "credibility_score": 0.0,
    "credibility_reasoning": "API Error: 402"
  },
  {
    "id": 6,
    "query": "Generate a plot summary for a sci-fi movie set on Mars",
    "status": "success",
    "latency": 2.0581135749816895,
    "result_count": 5,
    "data": {
      "query": "Generate a plot summary for a sci-fi movie set on Mars",
      "ai_overview": "In a sci-fi movie set on Mars, an astronaut survives a dust storm and must use ingenuity to survive until rescue. The film depicts NASA's efforts to bring him back to Earth. The story highlights human resilience and technology.",
      "organic_results": [
        {
          "title": "List of films set on Mars - Wikipedia",
          "url": "https://en.wikipedia.org/wiki/List_of_films_set_on_Mars",
          "snippet": "| Martian Land | 2015 | The direct-to-video science fiction film is set on Mars in the future, and humans live in domed cities that become threatened by sandstorms. | | A Message from Mars \"A Message From Mars (1913 film)\") | 1913 | The ruler of Mars sends a subject to Earth to reform a stingy man. | | Mission Mars \"Mission Mars (film)\") | 1968 | Three astronauts travel to Mars on an expedition but encounter strange forces on the planet. | | Mission to Mars | 2000 | A rescue mission is sent to Mars to recover the sole survivor of a scientific expedition, and the astronauts learn that Mars is not a dead planet. | [...] | Moonshot \"Moonshot (2022 film)\") | 2022 | In the science-fiction romantic comedy, two college students sneak onto a space shuttle to a terraformed Mars to be with their significant others, with the film's third act taking place on Mars. | | Our Heavenly Bodies | 1925 | | | Princess of Mars | 2009 | In a modern-day update of the 1912 novel A Princess of Mars, the direct-to-DVD film features former U.S. Army sniper John Carter being transported to Mars and becoming involved in a conflict among its inhabitants. | | Red Planet \"Red Planet (film)\") | 2000 | When a terraforming project on Mars goes awry, a rescue mission is sent to fix the system but crash-lands on the planet. | [...] | The Last Days on Mars | 2013 | On the first human mission to Mars, a crew member discovers fossil evidence of bacterial life. When contact is lost with him, the rest of the crew investigates and learns that there is still life on the planet. | | The Man from M.A.R.S. \"The Man from M.A.R.S. (1922 film)\") | 1922 | | | A Marriage in the Moon | 1910 | | | Mars \"Mars (1930 film)\") | 1930 | | | Mars&action=edit&redlink=1 \"Mars (1997 film) (page does not exist)\") | 1997 | Virtually a low-budget remake of Total Recall (1990), with martial arts star Olivier Gruner at the center of the action.",
          "score": 0.5,
          "embedding": null
        },
        {
          "title": "Mars Sci-Fi Story Outline - AI Prompt - DocsBot AI",
          "url": "https://docsbot.ai/prompts/creative/mars-sci-fi-story-outline",
          "snippet": "NEWNew: Per-Bot Roles & Permissions for Teams \u2192 DocsBot Logo Creative AI Prompt # Mars Sci-Fi Story Outline Outline a sci-fi narrative set on Mars involving oppression and rebellion. Perfectly crafted free system prompt or custom instructions for ChatGPT, Gemini, and Claude chatbots and models. ## Disclaimer This page contains user-generated content that may reference third-party concepts, methods, or trademarks for descriptive and educational purposes. All trademarks and proprietary terms belong to their respective owners. This content is not affiliated with, endorsed by, or sponsored by any third party, and is provided solely for informational use.",
          "score": 0.5,
          "embedding": null
        },
        {
          "title": "The Martian (film) - Wikipedia",
          "url": "https://en.wikipedia.org/wiki/The_Martian_(film)",
          "snippet": "In 2035, the crew of the Ares III mission to Mars is exploring Acidalia Planitia on Martian solar day (sol) 18 of their 31-sol expedition. A severe dust storm threatens their Mars Ascent Vehicle (MAV) and in the ensuing evacuation, astronaut Mark Watney is struck by flying debris and presumed dead. Facing imminent peril, the remaining crew takes off for their orbiting vessel, the _Hermes_, which will then return them to Earth. Watney awakens after the storm, having narrowly survived his injuries. As he recovers within the crew's surface habitat (\"Hab\"), he begins a video diary to document his thoughts on survival. Unable to communicate with Earth, his only chance of rescue is the next Mars mission in four years, when Ares IV will land at the Schiaparelli crater \"Schiaparelli (Martian [...] _The Martian_ is a 2015 epicscience fiction film directed by Ridley Scott from a screenplay by Drew Goddard. Based on Andy Weir's 2011 novel \"The Martian (Weir novel)\"), and distributed by 20th Century Fox, the film stars Matt Damon, alongside an ensemble cast featuring Jessica Chastain, Jeff Daniels, Kristen Wiig, Chiwetel Ejiofor, Sean Bean, Michael Pe\u00f1a, Kate Mara, Sebastian Stan, and Mackenzie Davis. The film depicts an astronaut's struggle to survive on Mars after being left behind and NASA's efforts to return him to Earth. [...] On Earth, NASA satellite planner Mindy Park notices Watney's activity from recorded satellite images, and suspects he must be alive. NASA director Teddy Sanders releases the news to the public but decides not to inform the Ares III crew en route to Earth, over flight director Mitch Henderson's strong objection. Watney explores the surrounding terrain and studies his maps, but he quickly journeys out to retrieve the _Pathfinder_ probe, hoping to restore its communications. Mars missions director Vincent Kapoor realizes this strategy, and quickly visits Jet Propulsion Laboratory (JPL) director Bruce Ng to use their replica of the probe. The agency makes contact with Watney and instructs him to link _Pathfinder_ to the rover, where he can now communicate by text.",
          "score": 0.5,
          "embedding": null
        },
        {
          "title": "\u201cThe Martian\u201d explained in detailed \u2014 Planexto",
          "url": "https://medium.com/@planexto10/the-martian-explained-in-detailed-planexto-4ad46a6be22f",
          "snippet": "Sitemap Open in app Sign in Write Search Sign in # \u201cThe Martian\u201d explained in detailed \u2014 Planexto Planexto 2 min read \u00b7 Jan 4, 2024 -- \u201cThe Martian\u201d is a 2015 science fiction film directed by Ridley Scott, based on Andy Weir\u2019s 2011 novel of the same name. The movie features an ensemble cast led by Matt Damon as Mark Watney. Here is a detailed plot summary: Mission to Mars The story begins with the Ares III space mission to Mars. Mark Watney, an astronaut and botanist, is presumed dead after a violent dust storm forces the crew to evacuate. As they leave the planet, they lose communication with Watney and assume he is dead. However, Watney survives, waking up to find himself alone on Mars. [...] Surviving on Mars Watney assesses his situation, realizing he has limited supplies and needs to survive until the next manned mission to Mars arrives, which is years away. Using his ingenuity and resourcefulness, Watney engineers solutions to grow food, generate water, and establish communication with NASA. He modifies the habitat, creating a sustainable environment. Back on Earth, satellite images reveal Watney\u2019s survival, and NASA learns he is alive. The news shocks the Ares III crew, who are on their way back to Earth. NASA begins working on a plan to rescue Watney, facing challenges like the limited resources of the Hermes spacecraft and the unpredictable nature of Mars. [...] Watney\u2019s challenges Watney faces life-threatening situations during his journey, including a sandstorm and the loss of communication with NASA. The crew of the Hermes risks their own safety to perform a daring and unplanned gravity assist around Earth, allowing them to return to Mars faster. Happy Ending Watney reaches the Ares IV MAV and prepares for the final stage of his journey. The Ares III crew coordinates with NASA to execute a mid-space rendezvous, successfully rescuing Watney. The crew returns to Earth, and Watney is reunited with his family and colleagues. \u201cThe Martian\u201d is a compelling story of survival, human ingenuity, and the collaborative efforts of individuals and organizations to overcome seemingly insurmountable challenges in the harsh environment of Mars.",
          "score": 0.4,
          "embedding": null
        },
        {
          "title": "Mission to Mars - Wikipedia",
          "url": "https://en.wikipedia.org/wiki/Mission_to_Mars",
          "snippet": "## Plot [edit] In 2020, the Mars I mission travels to the planet Mars, commanded by Luke Graham. The team discovers a bright white formation in the Cydonia region \"Cydonia (region of Mars)\"), which they suspect is an extrusion from a subsurface geothermal column of water, useful to future human colonization. After reporting this to the Earth-orbiting World Space Station, they investigate the formation and start hearing a low sound on their communications system. Their radar reports the formation is metal, but when they increase its power, a vortex kills everyone except Luke and the formation is revealed to be part of a large humanoid face. [...] Mission to Mars is a 2000 American science fiction adventure film directed by Brian De Palma, written by Jim \"Jim Thomas (screenwriter)\") and John Thomas \"John Thomas (screenwriter)\"), and Graham Yost, and suggested by Disney's theme park attraction of the same name \"Mission to Mars (attraction)\"). The film depicts the first crewed Mars exploration mission going awry; American astronaut Jim McConnell (Gary Sinise) helps to coordinate a rescue mission for a colleague. Principal support actors were Tim Robbins, Don Cheadle, Connie Nielsen, Jerry O'Connell, and Kim Delaney. Released theatrically by Buena Vista Pictures Distribution through Touchstone Pictures on March 10, 2000, the film was both a critical and commercial disappointment. ## Plot [edit] [...] The three astronauts enter the opening, which seals behind them. A three-dimensional projection of the Solar System depicts Mars, covered with water, being struck by a large asteroid and rendered uninhabitable. A projection of a humanoid Martian lifeform reveals the native Martians evacuated the planet in spaceships, one of which was sent to seed Earth with DNA to create life that could one day land on Mars and be recognized as descendants. An invitation is offered for one of their group to follow the Martians to their new home. Jim accepts the invitation and is sealed inside a small capsule. Terri and Luke arrive back to the ERV just as Phil is about to take off.",
          "score": 0.5,
          "embedding": null
        }
      ],
      "formatted_output": "# Search Results for: Generate a plot summary for a sci-fi movie set on Mars\n\n## AI Overview\nIn a sci-fi movie set on Mars, an astronaut survives a dust storm and must use ingenuity to survive until rescue. The film depicts NASA's efforts to bring him back to Earth. The story highlights human resilience and technology.\n\n---\n\n### 1. List of films set on Mars - Wikipedia (Credibility Score: 0.5)\nURL: https://en.wikipedia.org/wiki/List_of_films_set_on_Mars\nSnippet: | Martian Land | 2015 | The direct-to-video science fiction film is set on Mars in the future, and humans live in domed cities that become threatened by sandstorms. | | A Message from Mars \"A Message From Mars (1913 film)\") | 1913 | The ruler of Mars sends a subject to Earth to reform a stingy man. | | Mission Mars \"Mission Mars (film)\") | 1968 | Three astronauts travel to Mars on an expedition but encounter strange forces on the planet. | | Mission to Mars | 2000 | A rescue mission is sent to Mars to recover the sole survivor of a scientific expedition, and the astronauts learn that Mars is not a dead planet. | [...] | Moonshot \"Moonshot (2022 film)\") | 2022 | In the science-fiction romantic comedy, two college students sneak onto a space shuttle to a terraformed Mars to be with their significant others, with the film's third act taking place on Mars. | | Our Heavenly Bodies | 1925 | | | Princess of Mars | 2009 | In a modern-day update of the 1912 novel A Princess of Mars, the direct-to-DVD film features former U.S. Army sniper John Carter being transported to Mars and becoming involved in a conflict among its inhabitants. | | Red Planet \"Red Planet (film)\") | 2000 | When a terraforming project on Mars goes awry, a rescue mission is sent to fix the system but crash-lands on the planet. | [...] | The Last Days on Mars | 2013 | On the first human mission to Mars, a crew member discovers fossil evidence of bacterial life. When contact is lost with him, the rest of the crew investigates and learns that there is still life on the planet. | | The Man from M.A.R.S. \"The Man from M.A.R.S. (1922 film)\") | 1922 | | | A Marriage in the Moon | 1910 | | | Mars \"Mars (1930 film)\") | 1930 | | | Mars&action=edit&redlink=1 \"Mars (1997 film) (page does not exist)\") | 1997 | Virtually a low-budget remake of Total Recall (1990), with martial arts star Olivier Gruner at the center of the action.\n\n### 2. Mars Sci-Fi Story Outline - AI Prompt - DocsBot AI (Credibility Score: 0.5)\nURL: https://docsbot.ai/prompts/creative/mars-sci-fi-story-outline\nSnippet: NEWNew: Per-Bot Roles & Permissions for Teams \u2192 DocsBot Logo Creative AI Prompt # Mars Sci-Fi Story Outline Outline a sci-fi narrative set on Mars involving oppression and rebellion. Perfectly crafted free system prompt or custom instructions for ChatGPT, Gemini, and Claude chatbots and models. ## Disclaimer This page contains user-generated content that may reference third-party concepts, methods, or trademarks for descriptive and educational purposes. All trademarks and proprietary terms belong to their respective owners. This content is not affiliated with, endorsed by, or sponsored by any third party, and is provided solely for informational use.\n\n### 3. The Martian (film) - Wikipedia (Credibility Score: 0.5)\nURL: https://en.wikipedia.org/wiki/The_Martian_(film)\nSnippet: In 2035, the crew of the Ares III mission to Mars is exploring Acidalia Planitia on Martian solar day (sol) 18 of their 31-sol expedition. A severe dust storm threatens their Mars Ascent Vehicle (MAV) and in the ensuing evacuation, astronaut Mark Watney is struck by flying debris and presumed dead. Facing imminent peril, the remaining crew takes off for their orbiting vessel, the _Hermes_, which will then return them to Earth. Watney awakens after the storm, having narrowly survived his injuries. As he recovers within the crew's surface habitat (\"Hab\"), he begins a video diary to document his thoughts on survival. Unable to communicate with Earth, his only chance of rescue is the next Mars mission in four years, when Ares IV will land at the Schiaparelli crater \"Schiaparelli (Martian [...] _The Martian_ is a 2015 epicscience fiction film directed by Ridley Scott from a screenplay by Drew Goddard. Based on Andy Weir's 2011 novel \"The Martian (Weir novel)\"), and distributed by 20th Century Fox, the film stars Matt Damon, alongside an ensemble cast featuring Jessica Chastain, Jeff Daniels, Kristen Wiig, Chiwetel Ejiofor, Sean Bean, Michael Pe\u00f1a, Kate Mara, Sebastian Stan, and Mackenzie Davis. The film depicts an astronaut's struggle to survive on Mars after being left behind and NASA's efforts to return him to Earth. [...] On Earth, NASA satellite planner Mindy Park notices Watney's activity from recorded satellite images, and suspects he must be alive. NASA director Teddy Sanders releases the news to the public but decides not to inform the Ares III crew en route to Earth, over flight director Mitch Henderson's strong objection. Watney explores the surrounding terrain and studies his maps, but he quickly journeys out to retrieve the _Pathfinder_ probe, hoping to restore its communications. Mars missions director Vincent Kapoor realizes this strategy, and quickly visits Jet Propulsion Laboratory (JPL) director Bruce Ng to use their replica of the probe. The agency makes contact with Watney and instructs him to link _Pathfinder_ to the rover, where he can now communicate by text.\n\n### 4. Mission to Mars - Wikipedia (Credibility Score: 0.5)\nURL: https://en.wikipedia.org/wiki/Mission_to_Mars\nSnippet: ## Plot [edit] In 2020, the Mars I mission travels to the planet Mars, commanded by Luke Graham. The team discovers a bright white formation in the Cydonia region \"Cydonia (region of Mars)\"), which they suspect is an extrusion from a subsurface geothermal column of water, useful to future human colonization. After reporting this to the Earth-orbiting World Space Station, they investigate the formation and start hearing a low sound on their communications system. Their radar reports the formation is metal, but when they increase its power, a vortex kills everyone except Luke and the formation is revealed to be part of a large humanoid face. [...] Mission to Mars is a 2000 American science fiction adventure film directed by Brian De Palma, written by Jim \"Jim Thomas (screenwriter)\") and John Thomas \"John Thomas (screenwriter)\"), and Graham Yost, and suggested by Disney's theme park attraction of the same name \"Mission to Mars (attraction)\"). The film depicts the first crewed Mars exploration mission going awry; American astronaut Jim McConnell (Gary Sinise) helps to coordinate a rescue mission for a colleague. Principal support actors were Tim Robbins, Don Cheadle, Connie Nielsen, Jerry O'Connell, and Kim Delaney. Released theatrically by Buena Vista Pictures Distribution through Touchstone Pictures on March 10, 2000, the film was both a critical and commercial disappointment. ## Plot [edit] [...] The three astronauts enter the opening, which seals behind them. A three-dimensional projection of the Solar System depicts Mars, covered with water, being struck by a large asteroid and rendered uninhabitable. A projection of a humanoid Martian lifeform reveals the native Martians evacuated the planet in spaceships, one of which was sent to seed Earth with DNA to create life that could one day land on Mars and be recognized as descendants. An invitation is offered for one of their group to follow the Martians to their new home. Jim accepts the invitation and is sealed inside a small capsule. Terri and Luke arrive back to the ERV just as Phil is about to take off.\n\n### 5. \u201cThe Martian\u201d explained in detailed \u2014 Planexto (Credibility Score: 0.4)\nURL: https://medium.com/@planexto10/the-martian-explained-in-detailed-planexto-4ad46a6be22f\nSnippet: Sitemap Open in app Sign in Write Search Sign in # \u201cThe Martian\u201d explained in detailed \u2014 Planexto Planexto 2 min read \u00b7 Jan 4, 2024 -- \u201cThe Martian\u201d is a 2015 science fiction film directed by Ridley Scott, based on Andy Weir\u2019s 2011 novel of the same name. The movie features an ensemble cast led by Matt Damon as Mark Watney. Here is a detailed plot summary: Mission to Mars The story begins with the Ares III space mission to Mars. Mark Watney, an astronaut and botanist, is presumed dead after a violent dust storm forces the crew to evacuate. As they leave the planet, they lose communication with Watney and assume he is dead. However, Watney survives, waking up to find himself alone on Mars. [...] Surviving on Mars Watney assesses his situation, realizing he has limited supplies and needs to survive until the next manned mission to Mars arrives, which is years away. Using his ingenuity and resourcefulness, Watney engineers solutions to grow food, generate water, and establish communication with NASA. He modifies the habitat, creating a sustainable environment. Back on Earth, satellite images reveal Watney\u2019s survival, and NASA learns he is alive. The news shocks the Ares III crew, who are on their way back to Earth. NASA begins working on a plan to rescue Watney, facing challenges like the limited resources of the Hermes spacecraft and the unpredictable nature of Mars. [...] Watney\u2019s challenges Watney faces life-threatening situations during his journey, including a sandstorm and the loss of communication with NASA. The crew of the Hermes risks their own safety to perform a daring and unplanned gravity assist around Earth, allowing them to return to Mars faster. Happy Ending Watney reaches the Ares IV MAV and prepares for the final stage of his journey. The Ares III crew coordinates with NASA to execute a mid-space rendezvous, successfully rescuing Watney. The crew returns to Earth, and Watney is reunited with his family and colleagues. \u201cThe Martian\u201d is a compelling story of survival, human ingenuity, and the collaborative efforts of individuals and organizations to overcome seemingly insurmountable challenges in the harsh environment of Mars.\n",
      "token_estimate": 2107,
      "cached": false
    },
    "heuristic_score": 0.5800000000000001,
    "llm_score": 0.0,
    "llm_reasoning": "API Error: 402",
    "credibility_score": 0.0,
    "credibility_reasoning": "API Error: 402"
  },
  {
    "id": 7,
    "query": "How many continents are there?",
    "status": "success",
    "latency": 2.0909337997436523,
    "result_count": 5,
    "data": {
      "query": "How many continents are there?",
      "ai_overview": "There are seven continents: Asia, Africa, North America, South America, Antarctica, Europe, and Australia. Different models combine continents, but the standard count is seven.",
      "organic_results": [
        {
          "title": "How many continents are there in the world? It depends ...",
          "url": "https://www.sciencefocus.com/planet-earth/how-many-continents-are-there-in-the-world",
          "snippet": "# How many continents are there in the world? It depends who you ask There are either four, five, six, or seven continents in the world, depending on who you ask. Toby Saunders How many continents are there in the world? It's a simple enough question. But the answer is much more complex than you think. Essentially, it comes down to how you count a continent. Some argue that there are as few as four continents, for example, with each one classified as a landmass that is naturally separated by water. Using the four-continent model tells us that there are only AfroEurasia, America, Antarctica, and Australia. [...] Others argue there are six continents \u2013 Africa, America, Antarctica, Asia, Oceania, and Europe \u2013 with the Americans blended into one continent. If you merge together the Americas and only count vastly populated landmasses \u2013 thus excluding Antarctica \u2013 you would be left with five continents. ## How many continents are there in the world? There are seven continents in the world, according to most standards. In order from smallest to largest, they are: Oceania, Europe, Antarctica, South America, North America, Africa, and Asia. However, by some measurements, there are only four or five continents on Earth. By size, here are the standard seven continents in the world: ### Oceania - 8,511,000km\u00b2 [...] ## What makes a continent? A continent is typically defined as being a large continuous mass of land, loosely correlating with the positions of the tectonic plates and \u2018floating\u2019 on Earth's continental crust. Questions over where Europe ends and Asia begins, though, are an example of the lack of a definitive answer on the subject. There is a question as to what exactly defines each continent, which has caused confusion among geography teachers and students across the globe. The lack of a definitive answer as to what exactly makes a continent has led to the four, five, six, and seven-continent responses around the world.",
          "score": 0.5,
          "embedding": null
        },
        {
          "title": "Continents Vocabulary | Learn English",
          "url": "https://www.englishclub.com/vocabulary/world-continents.php",
          "snippet": "# Continents Vocabulary A continent is one of the world's main continuous pieces of land. (The word continent comes from the Latin terra continens, meaning \"continuous land\".) Continent is a geographical term, not political (continents are not man-made). Unfortunately, even the experts cannot agree on how many continents there are: 7 continents: Africa, Antarctica, Asia, Europe, North America, Oceania, South America 6 continents: Africa, Antarctica, Eurasia, North America, Oceania, South America 6 continents: Africa, America, Antarctica, Asia, Europe, Oceania 5 continents: Africa, America, Antarctica, Eurasia, Oceania 4 continents: Eurafrasia, America, Antarctica, Oceania [...] This chart lists what is probably the most widely-accepted number of continents (7), and shows the associated adjective and the noun used for a person from each continent: | continent | adjective | person | --- | Africa | African | an African | | Antarctica | Antarctic | Asia | Asian | an Asian | | Europe | European | a European | | North America | North American | a North American | | Oceania | Oceanian | an Oceanian | | South America | South American | a South American | Curiously, we have a word for somebody who comes from the planet Mars (a Martian), but we have no word for somebody who comes from the continent Antarctica ;)",
          "score": 0.5,
          "embedding": null
        },
        {
          "title": "Continent",
          "url": "https://en.wikipedia.org/wiki/Continent",
          "snippet": "25. ^ \"How many continents are there?\". Wonderopolis. Archived from the original on 29 May 2023. Retrieved 26 April 2020. If you count Europe and Asia as one continent (called Eurasia), then there are six continents. Some people also count North America and South America as one continent (called America), since the two land masses are separated only by the human-made Panama Canal. This would allow for a model with only five continents.wonderopolis 26. ^ Strobel, Christoph (2015). The Global Atlantic: 1400 to 1900. Routledge. pp. 13\u2013. ISBN \"ISBN (identifier)\") 978-1-317-52552-3. 27. ^ Manual of Modern Geography: 2. William Blackwood. 1870. pp. 18\u2013 \u2013 via Google Books. [...] 121. ^ \"Frequently Asked Questions - General Geography Information - How many continents are there?\". National Geographic Society. Archived from the original on 6 March 2008. Retrieved 26 September 2010. Some geographers list only six continents, combining Europe and Asia into Eurasia. In parts of the world, students learn that there are just five continents: Eurasia, Australia, Africa, Antarctica, and the Americas. 122. ^ Levin, Harold L. (2010). The earth through time (9th ed.). Hoboken, N.J.: J. Wiley. pp. 173\u2013174. ISBN \"ISBN (identifier)\") 978-0470387740. 123. ^ Levin 2010, p. 83. 124. ^ Levin 2010, p. 194. [...] A continent is any of several large terrestrial geographical regions. Continents are generally identified by convention \"Convention (norm)\") rather than any strict criteria. A continent could be a single large landmass, a landmass and nearby islands either on or beyond its continental shelf, or a part of a larger landmass, as in the case of Asia and Europe within Eurasia. Due to these varying definitions, the number of continents varies, up to seven or as few as four. Most English-speaking countries recognize seven continents. In order from largest to smallest in area, these seven are Asia, Africa, North America, South America, Antarctica, Europe, and Australia \"Australia (continent)\") (or sometimes Oceania or Australasia).",
          "score": 0.5,
          "embedding": null
        },
        {
          "title": "Continents Of The World",
          "url": "https://www.worldatlas.com/continents",
          "snippet": "Continents Of The World Continents Of The World Select a label on the map to start exploring the world Jump to: 7 Continents Continental Models What are the Seven Continents? There are seven continents in the world: Africa, Antarctica, Asia, Australia/Oceania, Europe, North America, and South America. However, depending on where you live, you may have learned that there are five, six, or even four continents. This is because there is no official criteria for determining continents. While the position of landmasses on continental crust may be used to determine continents, geopolitical factors also affect their delineation. Below is an overview of the world's continent using the most popular classification system, the seven continent method. Continents ### North America [...] ### Five Continents Image 9: Colored map of the world with the five continents model. Each color represents a continent: Purple for Africa, Green for Europe, Orange of Asia, Yellow for America, Blue for Australia / Oceania. | Continents | | Africa | | Europe | | Asia | | America | | Pacific | | More Information | | In the five continent model, North and South America are considered to be one continent called America. Antarctica is omitted due to its lack of permanent habitation. This model is used by the United Nations and found in the Olympic Charter. | ### Six Continents (Version 1) [...] ### Six Continents (Version 1) Image 10: Colored map of the world with a version of the six continents model. Each color represents a continent: Purple for Africa, Green for Europe, Orange for Asia, Yellow for America, Blue for Australia / Oceania, and Black for Antarctica. | Continents | | Africa | | Europe | | Asia | | America | | Australia / Oceania | | Antarctica | | More Information | | This model is most commonly taught in western Europe, including France and Spain. Here, North and South America are considered to be one single continent of America. | ### Six Continents (Version 2)",
          "score": 0.5,
          "embedding": null
        },
        {
          "title": "Continent | Definition, Map, & Facts - Britannica",
          "url": "https://www.britannica.com/science/continent",
          "snippet": "\u2022History Top Questions ### What is a continent? A continent is a large continuous mass of land conventionally regarded as a collective region. There are seven continents: Asia, Africa, North America, South America, Antarctica, Europe, and Australia (listed from largest to smallest in size). Sometimes Europe and Asia are considered one continent called Eurasia. Continents loosely correlate with the positions of tectonic plates. ### What is the largest continent? Asia is the largest continent on Earth by size. It is approximately 44,614,000 square kilometres (17,226,200 square miles). ### Do continents move? [...] Facebook X URL Feedback Thank you for your feedback Our editors will review what you\u2019ve submitted and determine whether to revise the article. External Websites PNAS - Regulating continent growth and composition by chemical weathering The Geological Society - Lyell Collection - Continent formation through time NERC Open Research Archive - Continent formation through time (PDF) Frontiers - Frontiers in Climate - Seven continents. One sky The New York Times - The Myth of Continents Geosciences LibreTexts - Assembling a Continent/10%3A_Klamath_Mountains/10.01%3A_Assembling_a_Continent) National Geographic - Continent Britannica Websites Articles from Britannica Encyclopedias for elementary and high school students. [...] continent, one of the larger continuous masses of land, namely, Asia, Africa, North America, South America, Antarctica, Europe, and Australia, listed in order of size. (Europe and Asia are sometimes considered a single continent, Eurasia.) There is great variation in the sizes of continents; Asia is more than five times as large as Australia. The largest island in the world, Greenland, is only about one-fourth the size of Australia. The continents differ sharply in their degree of compactness. Africa has the most regular coastline and, consequently, the lowest ratio of coastline to total area. Europe is the most irregular and indented and has by far the highest ratio of coastline to total area.",
          "score": 0.5,
          "embedding": null
        }
      ],
      "formatted_output": "# Search Results for: How many continents are there?\n\n## AI Overview\nThere are seven continents: Asia, Africa, North America, South America, Antarctica, Europe, and Australia. Different models combine continents, but the standard count is seven.\n\n---\n\n### 1. How many continents are there in the world? It depends ... (Credibility Score: 0.5)\nURL: https://www.sciencefocus.com/planet-earth/how-many-continents-are-there-in-the-world\nSnippet: # How many continents are there in the world? It depends who you ask There are either four, five, six, or seven continents in the world, depending on who you ask. Toby Saunders How many continents are there in the world? It's a simple enough question. But the answer is much more complex than you think. Essentially, it comes down to how you count a continent. Some argue that there are as few as four continents, for example, with each one classified as a landmass that is naturally separated by water. Using the four-continent model tells us that there are only AfroEurasia, America, Antarctica, and Australia. [...] Others argue there are six continents \u2013 Africa, America, Antarctica, Asia, Oceania, and Europe \u2013 with the Americans blended into one continent. If you merge together the Americas and only count vastly populated landmasses \u2013 thus excluding Antarctica \u2013 you would be left with five continents. ## How many continents are there in the world? There are seven continents in the world, according to most standards. In order from smallest to largest, they are: Oceania, Europe, Antarctica, South America, North America, Africa, and Asia. However, by some measurements, there are only four or five continents on Earth. By size, here are the standard seven continents in the world: ### Oceania - 8,511,000km\u00b2 [...] ## What makes a continent? A continent is typically defined as being a large continuous mass of land, loosely correlating with the positions of the tectonic plates and \u2018floating\u2019 on Earth's continental crust. Questions over where Europe ends and Asia begins, though, are an example of the lack of a definitive answer on the subject. There is a question as to what exactly defines each continent, which has caused confusion among geography teachers and students across the globe. The lack of a definitive answer as to what exactly makes a continent has led to the four, five, six, and seven-continent responses around the world.\n\n### 2. Continents Vocabulary | Learn English (Credibility Score: 0.5)\nURL: https://www.englishclub.com/vocabulary/world-continents.php\nSnippet: # Continents Vocabulary A continent is one of the world's main continuous pieces of land. (The word continent comes from the Latin terra continens, meaning \"continuous land\".) Continent is a geographical term, not political (continents are not man-made). Unfortunately, even the experts cannot agree on how many continents there are: 7 continents: Africa, Antarctica, Asia, Europe, North America, Oceania, South America 6 continents: Africa, Antarctica, Eurasia, North America, Oceania, South America 6 continents: Africa, America, Antarctica, Asia, Europe, Oceania 5 continents: Africa, America, Antarctica, Eurasia, Oceania 4 continents: Eurafrasia, America, Antarctica, Oceania [...] This chart lists what is probably the most widely-accepted number of continents (7), and shows the associated adjective and the noun used for a person from each continent: | continent | adjective | person | --- | Africa | African | an African | | Antarctica | Antarctic | Asia | Asian | an Asian | | Europe | European | a European | | North America | North American | a North American | | Oceania | Oceanian | an Oceanian | | South America | South American | a South American | Curiously, we have a word for somebody who comes from the planet Mars (a Martian), but we have no word for somebody who comes from the continent Antarctica ;)\n\n### 3. Continent (Credibility Score: 0.5)\nURL: https://en.wikipedia.org/wiki/Continent\nSnippet: 25. ^ \"How many continents are there?\". Wonderopolis. Archived from the original on 29 May 2023. Retrieved 26 April 2020. If you count Europe and Asia as one continent (called Eurasia), then there are six continents. Some people also count North America and South America as one continent (called America), since the two land masses are separated only by the human-made Panama Canal. This would allow for a model with only five continents.wonderopolis 26. ^ Strobel, Christoph (2015). The Global Atlantic: 1400 to 1900. Routledge. pp. 13\u2013. ISBN \"ISBN (identifier)\") 978-1-317-52552-3. 27. ^ Manual of Modern Geography: 2. William Blackwood. 1870. pp. 18\u2013 \u2013 via Google Books. [...] 121. ^ \"Frequently Asked Questions - General Geography Information - How many continents are there?\". National Geographic Society. Archived from the original on 6 March 2008. Retrieved 26 September 2010. Some geographers list only six continents, combining Europe and Asia into Eurasia. In parts of the world, students learn that there are just five continents: Eurasia, Australia, Africa, Antarctica, and the Americas. 122. ^ Levin, Harold L. (2010). The earth through time (9th ed.). Hoboken, N.J.: J. Wiley. pp. 173\u2013174. ISBN \"ISBN (identifier)\") 978-0470387740. 123. ^ Levin 2010, p. 83. 124. ^ Levin 2010, p. 194. [...] A continent is any of several large terrestrial geographical regions. Continents are generally identified by convention \"Convention (norm)\") rather than any strict criteria. A continent could be a single large landmass, a landmass and nearby islands either on or beyond its continental shelf, or a part of a larger landmass, as in the case of Asia and Europe within Eurasia. Due to these varying definitions, the number of continents varies, up to seven or as few as four. Most English-speaking countries recognize seven continents. In order from largest to smallest in area, these seven are Asia, Africa, North America, South America, Antarctica, Europe, and Australia \"Australia (continent)\") (or sometimes Oceania or Australasia).\n\n### 4. Continents Of The World (Credibility Score: 0.5)\nURL: https://www.worldatlas.com/continents\nSnippet: Continents Of The World Continents Of The World Select a label on the map to start exploring the world Jump to: 7 Continents Continental Models What are the Seven Continents? There are seven continents in the world: Africa, Antarctica, Asia, Australia/Oceania, Europe, North America, and South America. However, depending on where you live, you may have learned that there are five, six, or even four continents. This is because there is no official criteria for determining continents. While the position of landmasses on continental crust may be used to determine continents, geopolitical factors also affect their delineation. Below is an overview of the world's continent using the most popular classification system, the seven continent method. Continents ### North America [...] ### Five Continents Image 9: Colored map of the world with the five continents model. Each color represents a continent: Purple for Africa, Green for Europe, Orange of Asia, Yellow for America, Blue for Australia / Oceania. | Continents | | Africa | | Europe | | Asia | | America | | Pacific | | More Information | | In the five continent model, North and South America are considered to be one continent called America. Antarctica is omitted due to its lack of permanent habitation. This model is used by the United Nations and found in the Olympic Charter. | ### Six Continents (Version 1) [...] ### Six Continents (Version 1) Image 10: Colored map of the world with a version of the six continents model. Each color represents a continent: Purple for Africa, Green for Europe, Orange for Asia, Yellow for America, Blue for Australia / Oceania, and Black for Antarctica. | Continents | | Africa | | Europe | | Asia | | America | | Australia / Oceania | | Antarctica | | More Information | | This model is most commonly taught in western Europe, including France and Spain. Here, North and South America are considered to be one single continent of America. | ### Six Continents (Version 2)\n\n### 5. Continent | Definition, Map, & Facts - Britannica (Credibility Score: 0.5)\nURL: https://www.britannica.com/science/continent\nSnippet: \u2022History Top Questions ### What is a continent? A continent is a large continuous mass of land conventionally regarded as a collective region. There are seven continents: Asia, Africa, North America, South America, Antarctica, Europe, and Australia (listed from largest to smallest in size). Sometimes Europe and Asia are considered one continent called Eurasia. Continents loosely correlate with the positions of tectonic plates. ### What is the largest continent? Asia is the largest continent on Earth by size. It is approximately 44,614,000 square kilometres (17,226,200 square miles). ### Do continents move? [...] Facebook X URL Feedback Thank you for your feedback Our editors will review what you\u2019ve submitted and determine whether to revise the article. External Websites PNAS - Regulating continent growth and composition by chemical weathering The Geological Society - Lyell Collection - Continent formation through time NERC Open Research Archive - Continent formation through time (PDF) Frontiers - Frontiers in Climate - Seven continents. One sky The New York Times - The Myth of Continents Geosciences LibreTexts - Assembling a Continent/10%3A_Klamath_Mountains/10.01%3A_Assembling_a_Continent) National Geographic - Continent Britannica Websites Articles from Britannica Encyclopedias for elementary and high school students. [...] continent, one of the larger continuous masses of land, namely, Asia, Africa, North America, South America, Antarctica, Europe, and Australia, listed in order of size. (Europe and Asia are sometimes considered a single continent, Eurasia.) There is great variation in the sizes of continents; Asia is more than five times as large as Australia. The largest island in the world, Greenland, is only about one-fourth the size of Australia. The continents differ sharply in their degree of compactness. Africa has the most regular coastline and, consequently, the lowest ratio of coastline to total area. Europe is the most irregular and indented and has by far the highest ratio of coastline to total area.\n",
      "token_estimate": 2081,
      "cached": false
    },
    "heuristic_score": 0.72,
    "llm_score": 0.0,
    "llm_reasoning": "API Error: 402",
    "credibility_score": 0.0,
    "credibility_reasoning": "API Error: 402"
  },
  {
    "id": 8,
    "query": "Difference between machine learning and deep learning",
    "status": "success",
    "latency": 2.1511452198028564,
    "result_count": 5,
    "data": {
      "query": "Difference between machine learning and deep learning",
      "ai_overview": "Machine learning is a type of AI that adapts with minimal human input; deep learning is a more advanced subset of machine learning that uses neural networks to autonomously learn from large, complex datasets.",
      "organic_results": [
        {
          "title": "Deep Learning vs Machine Learning - Difference Between Data ...",
          "url": "https://aws.amazon.com/compare/the-difference-between-machine-learning-and-deep-learning/",
          "snippet": "Search # What\u2019s the Difference Between Machine Learning and Deep Learning? ## Page topics ## What\u2019s the Difference Between Machine Learning and Deep Learning? Machine learning (ML) is the science of training a computer program or system to perform tasks without explicit instructions. Computer systems use ML algorithms to process large quantities of data, identify data patterns, and predict accurate outcomes for unknown or new scenarios. Deep learning is a subset of ML that uses specific algorithmic structures called neural networks, modeled after the human brain. Deep learning methods attempt to automate more complex tasks that typically require human intelligence. For example, you can use deep learning to describe images, translate documents, or transcribe a sound file into text. [...] Machine Learning Deep Learning What is it? ML is an artificial intelligence (AI) methodology. Not all ML is deep learning. Deep learning is an advanced ML methodology. All deep learning is ML. Best suited for ML is best for well-defined tasks with structured and labeled data. Deep learning is best for complex tasks that require machines to make sense of unstructured data. Problem solving approach ML solves problems through statistics and mathematics. Deep learning combines statistics and mathematics with neural network architecture. Training You have to manually select and extract features from raw data and assign weights to train an ML model. Deep learning models can self-learn using feedback from known errors. Resources required [...] | | | | --- | | Machine Learning | Deep Learning | | What is it? | ML is an artificial intelligence (AI) methodology. Not all ML is deep learning. | Deep learning is an advanced ML methodology. All deep learning is ML. | | Best suited for | ML is best for well-defined tasks with structured and labeled data. | Deep learning is best for complex tasks that require machines to make sense of unstructured data. | | Problem solving approach | ML solves problems through statistics and mathematics. | Deep learning combines statistics and mathematics with neural network architecture. | | Training | You have to manually select and extract features from raw data and assign weights to train an ML model. | Deep learning models can self-learn using feedback from known errors.",
          "score": 0.5,
          "embedding": null
        },
        {
          "title": "Deep Learning vs Machine Learning: Key Differences - iSchool",
          "url": "https://ischool.syracuse.edu/deep-learning-vs-machine-learning/",
          "snippet": "While machine learning offers simplicity and clarity, deep learning unlocks powerful capabilities for more demanding tasks. Therefore, it\u2019s preferred to use machine learning when: On the other hand, deep learning might be more suitable when: In practice, the best solution is one that balances performance with practicality. Sometimes, the simplest solution that meets the requirements is best, even if a fancier deep network could squeeze out a few extra percentage points. As you grow more comfortable, you\u2019ll develop an intuition for which approach suits a given problem. [...] It\u2019s already clear that machine learning and deep learning are closely connected. In fact, deep learning is essentially a more advanced subset of machine learning. They both involve training models that make predictions or decisions based on data, with one using more complex neural networks that allow it to handle more detailed and unstructured data. The differences between deep learning and machine learning become more apparent when we directly compare them in the following categories: ### Data requirements Machine learning models usually perform best when working with smaller amounts of data, such as a few hundred or thousand examples. They work especially well when that data is structured and clearly labeled. [...] Deep learning models, on the other hand, need more time and resources to train due to their complexity and the size of the data they use. Training such models usually requires powerful GPUs (graphics processing units) or cloud computing services, and they consume more memory and energy compared to simpler machine learning models. ## When to Use Machine Learning vs. Deep Learning Understanding both approaches, particularly the differences between deep learning and machine learning, is necessary when deciding which to use for your project. Both have their strengths, and knowing when to apply each one naturally leads to better results.",
          "score": 0.95,
          "embedding": null
        },
        {
          "title": "Deep learning vs. machine learning: A complete guide - Zendesk",
          "url": "https://www.zendesk.com/blog/machine-learning-and-deep-learning/",
          "snippet": "Deep learning (DL) is an evolution of machine learning (ML). Both are algorithms that use data to learn, but the key difference is how they process and learn from it. For example: In fact, a deep learning model is able to learn through its own method of computing\u2014a technique that makes it seem like it has its own brain. Machine learning and deep learning push the boundaries of innovation by powering tools with artificial intelligence (AI). From fully autonomous AI agents and self-driving cars to curated user feeds and personalized Netflix recommendations, ML and DL are everywhere. [...] ### What is deep learning? Deep learning is a subset of machine learning that uses an artificial neural network to autonomously learn, make intelligent decisions, and determine prediction accuracy without human intervention. Because deep learning models analyze data continuously, they build extensive knowledge over time and draw conclusions by taking in information, consulting data reserves, and determining an answer. Deep learning applications use a layered structure of algorithms\u2014AKA neural networks\u2014to intake unlabeled data (the input), identify patterns, and develop a final response (the output). There are various types of neural networks, including: Because of these neural networks, deep learning tends to be more advanced than standard machine learning models. [...] DL and ML are AI algorithms that simulate human intelligence. Along with AI, these technologies power AI-driven tools and programs. Below, we cover the differences between deep learning vs. machine learning vs. artificial intelligence.",
          "score": 0.5,
          "embedding": null
        },
        {
          "title": "Deep Learning vs. Machine Learning: A Beginner's Guide - Coursera",
          "url": "https://www.coursera.org/articles/ai-vs-deep-learning-vs-machine-learning-beginners-guide",
          "snippet": "### ## What is deep learning vs. machine learning? Thanks to pop culture depictions from 2001: A Space Odyssey to The Terminator, many of us have some conception of AI. Oxford Languages defines AI as \u201cthe theory and development of computer systems able to perform tasks that normally require human intelligence.\u201d Britannica offers a similar definition: \u201cthe ability of a digital computer or computer-controlled robot to perform tasks commonly associated with intelligent beings.\u201d Machine learning and deep learning are both types of AI. In short, machine learning is AI that can automatically adapt with minimal human interference. Deep learning is a subset of machine learning that uses artificial neural networks (ANNs) to mimic the learning process of the human brain. [...] # Deep Learning vs. Machine Learning: A Beginner\u2019s Guide ![[Featured Image] A person works on a laptop at a living room table.]( ## Key takeaways While machine learning and deep learning are both types of AI, machine learning is a subset of AI, and deep learning is a subset of machine learning. Machine learning models require human intervention when they get something wrong, whereas deep learning models can learn from their own mistakes. While deep learning models require large amounts of data for training, you can train machine learning models on smaller data sets. [...] ## What is deep learning? Where machine learning algorithms generally need human correction when they get something wrong, deep learning algorithms can improve their outcomes through repetition without human intervention. A machine learning algorithm can learn from relatively small sets of data, but a deep learning algorithm requires big data sets that might include diverse and unstructured data.",
          "score": 0.5,
          "embedding": null
        },
        {
          "title": "Deep Learning vs. Machine Learning - Azure Machine Learning",
          "url": "https://learn.microsoft.com/en-us/azure/machine-learning/concept-deep-learning-vs-machine-learning?view=azureml-api-2",
          "snippet": "Deep learning is a subset of machine learning that's based on artificial neural networks. The learning process is deep because the structure of artificial neural networks consists of multiple input, output, and hidden layers. Each layer contains units that transform the input data into information that the next layer can use for a certain predictive task. Because of this structure, a machine can learn through its own data processing. Machine learning is a subset of artificial intelligence that uses techniques (such as deep learning) that enable machines to use experience to improve their ability to perform tasks. The learning process is composed of the following steps: [...] By using machine learning and deep learning techniques, you can build computer systems and applications that do tasks that are commonly associated with human intelligence. These tasks include image recognition, speech recognition, and language translation. ## Techniques of deep learning and machine learning Now that you have a basic understanding of how machine learning differs from deep learning, let's compare the two techniques. In machine learning, the algorithm needs to be told how to make an accurate prediction by consuming more information. (For example, by performing feature extraction.) In deep learning, the algorithm can learn how to make an accurate prediction through its own data processing because it uses the artificial neural network structure.",
          "score": 0.5,
          "embedding": null
        }
      ],
      "formatted_output": "# Search Results for: Difference between machine learning and deep learning\n\n## AI Overview\nMachine learning is a type of AI that adapts with minimal human input; deep learning is a more advanced subset of machine learning that uses neural networks to autonomously learn from large, complex datasets.\n\n---\n\n### 1. Deep Learning vs Machine Learning: Key Differences - iSchool (Credibility Score: 0.95)\nURL: https://ischool.syracuse.edu/deep-learning-vs-machine-learning/\nSnippet: While machine learning offers simplicity and clarity, deep learning unlocks powerful capabilities for more demanding tasks. Therefore, it\u2019s preferred to use machine learning when: On the other hand, deep learning might be more suitable when: In practice, the best solution is one that balances performance with practicality. Sometimes, the simplest solution that meets the requirements is best, even if a fancier deep network could squeeze out a few extra percentage points. As you grow more comfortable, you\u2019ll develop an intuition for which approach suits a given problem. [...] It\u2019s already clear that machine learning and deep learning are closely connected. In fact, deep learning is essentially a more advanced subset of machine learning. They both involve training models that make predictions or decisions based on data, with one using more complex neural networks that allow it to handle more detailed and unstructured data. The differences between deep learning and machine learning become more apparent when we directly compare them in the following categories: ### Data requirements Machine learning models usually perform best when working with smaller amounts of data, such as a few hundred or thousand examples. They work especially well when that data is structured and clearly labeled. [...] Deep learning models, on the other hand, need more time and resources to train due to their complexity and the size of the data they use. Training such models usually requires powerful GPUs (graphics processing units) or cloud computing services, and they consume more memory and energy compared to simpler machine learning models. ## When to Use Machine Learning vs. Deep Learning Understanding both approaches, particularly the differences between deep learning and machine learning, is necessary when deciding which to use for your project. Both have their strengths, and knowing when to apply each one naturally leads to better results.\n\n### 2. Deep Learning vs Machine Learning - Difference Between Data ... (Credibility Score: 0.5)\nURL: https://aws.amazon.com/compare/the-difference-between-machine-learning-and-deep-learning/\nSnippet: Search # What\u2019s the Difference Between Machine Learning and Deep Learning? ## Page topics ## What\u2019s the Difference Between Machine Learning and Deep Learning? Machine learning (ML) is the science of training a computer program or system to perform tasks without explicit instructions. Computer systems use ML algorithms to process large quantities of data, identify data patterns, and predict accurate outcomes for unknown or new scenarios. Deep learning is a subset of ML that uses specific algorithmic structures called neural networks, modeled after the human brain. Deep learning methods attempt to automate more complex tasks that typically require human intelligence. For example, you can use deep learning to describe images, translate documents, or transcribe a sound file into text. [...] Machine Learning Deep Learning What is it? ML is an artificial intelligence (AI) methodology. Not all ML is deep learning. Deep learning is an advanced ML methodology. All deep learning is ML. Best suited for ML is best for well-defined tasks with structured and labeled data. Deep learning is best for complex tasks that require machines to make sense of unstructured data. Problem solving approach ML solves problems through statistics and mathematics. Deep learning combines statistics and mathematics with neural network architecture. Training You have to manually select and extract features from raw data and assign weights to train an ML model. Deep learning models can self-learn using feedback from known errors. Resources required [...] | | | | --- | | Machine Learning | Deep Learning | | What is it? | ML is an artificial intelligence (AI) methodology. Not all ML is deep learning. | Deep learning is an advanced ML methodology. All deep learning is ML. | | Best suited for | ML is best for well-defined tasks with structured and labeled data. | Deep learning is best for complex tasks that require machines to make sense of unstructured data. | | Problem solving approach | ML solves problems through statistics and mathematics. | Deep learning combines statistics and mathematics with neural network architecture. | | Training | You have to manually select and extract features from raw data and assign weights to train an ML model. | Deep learning models can self-learn using feedback from known errors.\n\n### 3. Deep learning vs. machine learning: A complete guide - Zendesk (Credibility Score: 0.5)\nURL: https://www.zendesk.com/blog/machine-learning-and-deep-learning/\nSnippet: Deep learning (DL) is an evolution of machine learning (ML). Both are algorithms that use data to learn, but the key difference is how they process and learn from it. For example: In fact, a deep learning model is able to learn through its own method of computing\u2014a technique that makes it seem like it has its own brain. Machine learning and deep learning push the boundaries of innovation by powering tools with artificial intelligence (AI). From fully autonomous AI agents and self-driving cars to curated user feeds and personalized Netflix recommendations, ML and DL are everywhere. [...] ### What is deep learning? Deep learning is a subset of machine learning that uses an artificial neural network to autonomously learn, make intelligent decisions, and determine prediction accuracy without human intervention. Because deep learning models analyze data continuously, they build extensive knowledge over time and draw conclusions by taking in information, consulting data reserves, and determining an answer. Deep learning applications use a layered structure of algorithms\u2014AKA neural networks\u2014to intake unlabeled data (the input), identify patterns, and develop a final response (the output). There are various types of neural networks, including: Because of these neural networks, deep learning tends to be more advanced than standard machine learning models. [...] DL and ML are AI algorithms that simulate human intelligence. Along with AI, these technologies power AI-driven tools and programs. Below, we cover the differences between deep learning vs. machine learning vs. artificial intelligence.\n\n### 4. Deep Learning vs. Machine Learning: A Beginner's Guide - Coursera (Credibility Score: 0.5)\nURL: https://www.coursera.org/articles/ai-vs-deep-learning-vs-machine-learning-beginners-guide\nSnippet: ### ## What is deep learning vs. machine learning? Thanks to pop culture depictions from 2001: A Space Odyssey to The Terminator, many of us have some conception of AI. Oxford Languages defines AI as \u201cthe theory and development of computer systems able to perform tasks that normally require human intelligence.\u201d Britannica offers a similar definition: \u201cthe ability of a digital computer or computer-controlled robot to perform tasks commonly associated with intelligent beings.\u201d Machine learning and deep learning are both types of AI. In short, machine learning is AI that can automatically adapt with minimal human interference. Deep learning is a subset of machine learning that uses artificial neural networks (ANNs) to mimic the learning process of the human brain. [...] # Deep Learning vs. Machine Learning: A Beginner\u2019s Guide ![[Featured Image] A person works on a laptop at a living room table.]( ## Key takeaways While machine learning and deep learning are both types of AI, machine learning is a subset of AI, and deep learning is a subset of machine learning. Machine learning models require human intervention when they get something wrong, whereas deep learning models can learn from their own mistakes. While deep learning models require large amounts of data for training, you can train machine learning models on smaller data sets. [...] ## What is deep learning? Where machine learning algorithms generally need human correction when they get something wrong, deep learning algorithms can improve their outcomes through repetition without human intervention. A machine learning algorithm can learn from relatively small sets of data, but a deep learning algorithm requires big data sets that might include diverse and unstructured data.\n\n### 5. Deep Learning vs. Machine Learning - Azure Machine Learning (Credibility Score: 0.5)\nURL: https://learn.microsoft.com/en-us/azure/machine-learning/concept-deep-learning-vs-machine-learning?view=azureml-api-2\nSnippet: Deep learning is a subset of machine learning that's based on artificial neural networks. The learning process is deep because the structure of artificial neural networks consists of multiple input, output, and hidden layers. Each layer contains units that transform the input data into information that the next layer can use for a certain predictive task. Because of this structure, a machine can learn through its own data processing. Machine learning is a subset of artificial intelligence that uses techniques (such as deep learning) that enable machines to use experience to improve their ability to perform tasks. The learning process is composed of the following steps: [...] By using machine learning and deep learning techniques, you can build computer systems and applications that do tasks that are commonly associated with human intelligence. These tasks include image recognition, speech recognition, and language translation. ## Techniques of deep learning and machine learning Now that you have a basic understanding of how machine learning differs from deep learning, let's compare the two techniques. In machine learning, the algorithm needs to be told how to make an accurate prediction by consuming more information. (For example, by performing feature extraction.) In deep learning, the algorithm can learn how to make an accurate prediction through its own data processing because it uses the artificial neural network structure.\n",
      "token_estimate": 2008,
      "cached": false
    },
    "heuristic_score": 0.8666666666666666,
    "llm_score": 0.0,
    "llm_reasoning": "API Error: 402",
    "credibility_score": 0.0,
    "credibility_reasoning": "API Error: 402"
  },
  {
    "id": 9,
    "query": "Explain the difference between optimistic and pessimistic locking in databases",
    "status": "success",
    "latency": 2.1788923740386963,
    "result_count": 5,
    "data": {
      "query": "Explain the difference between optimistic and pessimistic locking in databases",
      "ai_overview": "Optimistic locking allows concurrent transactions but checks for conflicts at commit; pessimistic locking locks records to prevent conflicts. Pessimistic locking is used when conflicts are likely; optimistic when they are rare.",
      "organic_results": [
        {
          "title": "Database Internals - Optimistic vs Pessimistic - Curious Engineer",
          "url": "https://vivekbansal.substack.com/p/optimistic-vs-pessimistic",
          "snippet": "Since the write operation requires the write(exclusive) lock and there can be no read(shared) locks in progress, that\u2019s why there cannot be simultaneous updates for the same record. ## Conclusion The main thing between which one to choose among Optimistic locking vs Pessimistic locking depends on how likely is it to get conflicts among your transactions and how much effort is required to roll back the transactions if there are conflicts. Pessimistic locking is useful when you have a large number of transactions facing conflicts and thus end up getting rolled back. The cost of retrying the transaction is very high and thus pessimistic locking ensures that the transaction should pass through. [...] Thus, if the version read at the time of writing is different than the version in the table row, then there is a conflict and the user can restart the transaction. In case of conflicts, there will be \u201c0 rows affected\u201d in the transaction sent to the database and this output can be used by the application to retry the transaction. ## Pessimistic Locking > Pessimistic Locking says a record is locked while it is edited Pessimistic locking is based on the concept that conflicts are likely and the transactions need to lock the data on which the reads and writes are being performed. In the diagram below here is the sequence of operations: [...] In the diagram below here is the sequence of operations: 1. Alice requests to view the iPhone on the Amazon website. 2. Bob requests to view the iPhone on the Amazon website. 3. Bob gets the response back successfully and then tries to buy the product. 4. While Alice\u2019s read transaction is in progress, the UPDATE made by Bob will be blocked. This is because while a shared read lock is in progress, an exclusive write lock cannot be acquired. 5. Thus, when Alice\u2019s read transaction is committed and the shared read lock is released, Bob\u2019s UPDATE command gets the exclusive write lock and then the transaction is committed.",
          "score": 0.5,
          "embedding": null
        },
        {
          "title": "Pessimistic Locking Vs. Optimistic Locking - Modern Treasury",
          "url": "https://www.moderntreasury.com/learn/pessimistic-locking-vs-optimistic-locking",
          "snippet": "Race conditions, which happen when two transactions or processes try to update the same record at the same time, are handled differently by pessimistic and optimistic locking procedures. Pessimistic locking makes transactions queue. A transaction cannot be completed until the one ahead of it has updated the record. Optimistic locking allows transactions to happen simultaneously. Validation is performed when the transactions are committed to the record, which may require retries if the record version has changed. [...] ## What is Pessimistic Locking? Pessimistic locking is a concept based on the assumption that conflicts are likely to occur when multiple users or processes attempt to access and update the same resource simultaneously. With this approach, the idea is to lock first and update the information later, ensuring there are fewer conflicts. ### How Does Pessimistic Locking Work? When a transaction occurs, the database record is accessed. That\u2019s when the record is locked. No other transaction can take place or update that record until the lock is released. Think of this like standing in line at a store. You\u2019re queued and ready to make a purchase, but only the first person in the line can check out. Not everyone can check out at the same time. [...] Both of these processes can handle concurrent transactions. For financial situations in which conflicts are likely and volume is low, pessimistic locking can be a sensible approach. However, for most modern ledger database designs needing immutability and continuous performance, optimistic locking makes more sense, as it is more flexible. Get the latest articles, guides, and insights delivered to your inbox. More from ## Learn Ledgers are foundational to any company that moves money at scale. Explore the accounting fundamentals behind the ledgering process, the differences between application ledgers and general ledgers, and more.",
          "score": 0.5,
          "embedding": null
        },
        {
          "title": "Optimism vs Pessimism in Distributed Systems - Marc's Blog",
          "url": "https://brooker.co.za/blog/2023/10/18/optimism.html",
          "snippet": "Example 2: OCC Optimistic concurrency control and its tradeoffs with pessimistic locking-based approaches is a classic topic (maybe the most classic topic) in distributed databases. I won\u2019t try advance that debate here. Instead, to summarize: optimistic concurrency control is a way of implementing isolated (as in ACID I) transactions that assumes that other concurrent transactions don\u2019t conflict, and detecting at the last moment if that assumption is wrong. Pessimistic approaches like the classic two-phase locking, on the other hand, do a whole lot of coordination based on the assumption that other transactions do conflict, and it\u2019s worth detecting that early while there\u2019s still time to avoid duplicate work and make smart scheduling decisions. [...] OCC systems, in general, coordinate less than pessimistic systems when their optimistic assumption is right, and more than pessimistic systems when the optimistic assumption is wrong. Comparing these two is approaches is a hard enough first-order problem, but to complicate things further the choice between optimism and pessimism leads to a number of second-order problems too. For example, the number of contending transactions depends on the number of concurrent transactions, and the number of concurrent transactions depends on lock wait times in pessimistic systems and retry rates in optimistic systems. In both kinds of systems, this leads to a direct feedback loop between past contention and future contention. Example 3: Leases [...] Example 3: Leases Leases are a kind of time-based lock widely used in distributed systems. In most systems, a lease is replacing a number of coordination steps. One component takes a lease, and then uses that lease as a license to multiple things without worrying that other components are doing conflicting things, or may disagree, or whatever. Freed from the worry about conflicts, the lease-holding component can avoid coordinating and go ahead at full speed.",
          "score": 0.5,
          "embedding": null
        },
        {
          "title": "Optimistic vs. Pessimistic locking - Stack Overflow",
          "url": "https://stackoverflow.com/questions/129329/optimistic-vs-pessimistic-locking",
          "snippet": "Optimistic locking is useful if the possibility for conflicts is very low \u2013 there are many records but relatively few users, or very few updates and mostly read-type operations. [...] You can check my answer of the lost update and write skew examples with optimistic locking(without `SELECT FOR UPDATE`) and pessimistic locking(with `SELECT FOR UPDATE)` in MySQL. Share Improve this answer edited Feb 9, 2023 at 5:34 Henry Ecker\u2666 35.9k1919 gold badges4848 silver badges6767 bronze badges answered Oct 14, 2022 at 15:43 Super Kai - Kazuya Ito 43.1k2323 gold badges261261 silver badges259259 bronze badges ## Comments 6 On a more practical note, when updating a distributed system, optimistic locking in the DB may be inadequate to provide the consistency needed across all parts of the distributed system. [...] Because both Alice and Bob have read the `account` with the PK value of `1`, neither of them can change it until one user releases the read lock. This is because a write operation requires a write/exclusive lock acquisition, and shared/read locks prevent write/exclusive locks. Only after Alice has committed her transaction and the read lock was released on the `account` row, Bob `UPDATE` will resume and apply the change. Until Alice releases the read lock, Bob's UPDATE blocks. ## Optimistic Locking Optimistic Locking allows the conflict to occur but detects it upon applying Alice's UPDATE as the version has changed.",
          "score": 0.75,
          "embedding": null
        },
        {
          "title": "Pessimistic vs. Optimistic Locking in MySQL",
          "url": "https://dev.to/jszutkowski/pessimistic-vs-optimistic-locking-in-mysql-3hgc",
          "snippet": "On the other hand, optimistic locking may be a preferred strategy when there is no risk of repeating the operation causing side effects. It is particularly suitable when your application does not involve calling external APIs or sending emails during the operation. In such cases, conflicts resulting from optimistic locking are unlikely to have significant consequences. By allowing multiple transactions to access and modify the same data concurrently, optimistic locking improves efficiency and performance, especially in scenarios where conflicts are infrequent. # Conclusion [...] Pessimistic locking may be a suitable choice in scenarios involving batch processing, particularly when multiple consumers are involved. In such cases, where each row needs to be processed, it is crucial to prevent multiple consumers from selecting the same row simultaneously. By using the `FOR UPDATE SKIP LOCKED` clause, you can ensure that only one consumer locks and processes a specific row, while others skip over it and proceed to the next available row. This approach helps maintain data integrity and prevents conflicts in batch processing scenarios. [...] As you can see in the diagram above, the first user retrieves a record from the account table and attempts to debit the account by $70 based on the received data. At the same time, the second user performs the same operation, based on the data fetched from database. After these two updates, the account balance will be negative, which we want to avoid for the purpose of this article. How can we prevent such situations at the database level? In MySQL 8, we can achieve this in two ways: by using pessimistic or optimistic locking.",
          "score": 0.5,
          "embedding": null
        }
      ],
      "formatted_output": "# Search Results for: Explain the difference between optimistic and pessimistic locking in databases\n\n## AI Overview\nOptimistic locking allows concurrent transactions but checks for conflicts at commit; pessimistic locking locks records to prevent conflicts. Pessimistic locking is used when conflicts are likely; optimistic when they are rare.\n\n---\n\n### 1. Optimistic vs. Pessimistic locking - Stack Overflow (Credibility Score: 0.75)\nURL: https://stackoverflow.com/questions/129329/optimistic-vs-pessimistic-locking\nSnippet: Optimistic locking is useful if the possibility for conflicts is very low \u2013 there are many records but relatively few users, or very few updates and mostly read-type operations. [...] You can check my answer of the lost update and write skew examples with optimistic locking(without `SELECT FOR UPDATE`) and pessimistic locking(with `SELECT FOR UPDATE)` in MySQL. Share Improve this answer edited Feb 9, 2023 at 5:34 Henry Ecker\u2666 35.9k1919 gold badges4848 silver badges6767 bronze badges answered Oct 14, 2022 at 15:43 Super Kai - Kazuya Ito 43.1k2323 gold badges261261 silver badges259259 bronze badges ## Comments 6 On a more practical note, when updating a distributed system, optimistic locking in the DB may be inadequate to provide the consistency needed across all parts of the distributed system. [...] Because both Alice and Bob have read the `account` with the PK value of `1`, neither of them can change it until one user releases the read lock. This is because a write operation requires a write/exclusive lock acquisition, and shared/read locks prevent write/exclusive locks. Only after Alice has committed her transaction and the read lock was released on the `account` row, Bob `UPDATE` will resume and apply the change. Until Alice releases the read lock, Bob's UPDATE blocks. ## Optimistic Locking Optimistic Locking allows the conflict to occur but detects it upon applying Alice's UPDATE as the version has changed.\n\n### 2. Database Internals - Optimistic vs Pessimistic - Curious Engineer (Credibility Score: 0.5)\nURL: https://vivekbansal.substack.com/p/optimistic-vs-pessimistic\nSnippet: Since the write operation requires the write(exclusive) lock and there can be no read(shared) locks in progress, that\u2019s why there cannot be simultaneous updates for the same record. ## Conclusion The main thing between which one to choose among Optimistic locking vs Pessimistic locking depends on how likely is it to get conflicts among your transactions and how much effort is required to roll back the transactions if there are conflicts. Pessimistic locking is useful when you have a large number of transactions facing conflicts and thus end up getting rolled back. The cost of retrying the transaction is very high and thus pessimistic locking ensures that the transaction should pass through. [...] Thus, if the version read at the time of writing is different than the version in the table row, then there is a conflict and the user can restart the transaction. In case of conflicts, there will be \u201c0 rows affected\u201d in the transaction sent to the database and this output can be used by the application to retry the transaction. ## Pessimistic Locking > Pessimistic Locking says a record is locked while it is edited Pessimistic locking is based on the concept that conflicts are likely and the transactions need to lock the data on which the reads and writes are being performed. In the diagram below here is the sequence of operations: [...] In the diagram below here is the sequence of operations: 1. Alice requests to view the iPhone on the Amazon website. 2. Bob requests to view the iPhone on the Amazon website. 3. Bob gets the response back successfully and then tries to buy the product. 4. While Alice\u2019s read transaction is in progress, the UPDATE made by Bob will be blocked. This is because while a shared read lock is in progress, an exclusive write lock cannot be acquired. 5. Thus, when Alice\u2019s read transaction is committed and the shared read lock is released, Bob\u2019s UPDATE command gets the exclusive write lock and then the transaction is committed.\n\n### 3. Pessimistic Locking Vs. Optimistic Locking - Modern Treasury (Credibility Score: 0.5)\nURL: https://www.moderntreasury.com/learn/pessimistic-locking-vs-optimistic-locking\nSnippet: Race conditions, which happen when two transactions or processes try to update the same record at the same time, are handled differently by pessimistic and optimistic locking procedures. Pessimistic locking makes transactions queue. A transaction cannot be completed until the one ahead of it has updated the record. Optimistic locking allows transactions to happen simultaneously. Validation is performed when the transactions are committed to the record, which may require retries if the record version has changed. [...] ## What is Pessimistic Locking? Pessimistic locking is a concept based on the assumption that conflicts are likely to occur when multiple users or processes attempt to access and update the same resource simultaneously. With this approach, the idea is to lock first and update the information later, ensuring there are fewer conflicts. ### How Does Pessimistic Locking Work? When a transaction occurs, the database record is accessed. That\u2019s when the record is locked. No other transaction can take place or update that record until the lock is released. Think of this like standing in line at a store. You\u2019re queued and ready to make a purchase, but only the first person in the line can check out. Not everyone can check out at the same time. [...] Both of these processes can handle concurrent transactions. For financial situations in which conflicts are likely and volume is low, pessimistic locking can be a sensible approach. However, for most modern ledger database designs needing immutability and continuous performance, optimistic locking makes more sense, as it is more flexible. Get the latest articles, guides, and insights delivered to your inbox. More from ## Learn Ledgers are foundational to any company that moves money at scale. Explore the accounting fundamentals behind the ledgering process, the differences between application ledgers and general ledgers, and more.\n\n### 4. Optimism vs Pessimism in Distributed Systems - Marc's Blog (Credibility Score: 0.5)\nURL: https://brooker.co.za/blog/2023/10/18/optimism.html\nSnippet: Example 2: OCC Optimistic concurrency control and its tradeoffs with pessimistic locking-based approaches is a classic topic (maybe the most classic topic) in distributed databases. I won\u2019t try advance that debate here. Instead, to summarize: optimistic concurrency control is a way of implementing isolated (as in ACID I) transactions that assumes that other concurrent transactions don\u2019t conflict, and detecting at the last moment if that assumption is wrong. Pessimistic approaches like the classic two-phase locking, on the other hand, do a whole lot of coordination based on the assumption that other transactions do conflict, and it\u2019s worth detecting that early while there\u2019s still time to avoid duplicate work and make smart scheduling decisions. [...] OCC systems, in general, coordinate less than pessimistic systems when their optimistic assumption is right, and more than pessimistic systems when the optimistic assumption is wrong. Comparing these two is approaches is a hard enough first-order problem, but to complicate things further the choice between optimism and pessimism leads to a number of second-order problems too. For example, the number of contending transactions depends on the number of concurrent transactions, and the number of concurrent transactions depends on lock wait times in pessimistic systems and retry rates in optimistic systems. In both kinds of systems, this leads to a direct feedback loop between past contention and future contention. Example 3: Leases [...] Example 3: Leases Leases are a kind of time-based lock widely used in distributed systems. In most systems, a lease is replacing a number of coordination steps. One component takes a lease, and then uses that lease as a license to multiple things without worrying that other components are doing conflicting things, or may disagree, or whatever. Freed from the worry about conflicts, the lease-holding component can avoid coordinating and go ahead at full speed.\n\n### 5. Pessimistic vs. Optimistic Locking in MySQL (Credibility Score: 0.5)\nURL: https://dev.to/jszutkowski/pessimistic-vs-optimistic-locking-in-mysql-3hgc\nSnippet: On the other hand, optimistic locking may be a preferred strategy when there is no risk of repeating the operation causing side effects. It is particularly suitable when your application does not involve calling external APIs or sending emails during the operation. In such cases, conflicts resulting from optimistic locking are unlikely to have significant consequences. By allowing multiple transactions to access and modify the same data concurrently, optimistic locking improves efficiency and performance, especially in scenarios where conflicts are infrequent. # Conclusion [...] Pessimistic locking may be a suitable choice in scenarios involving batch processing, particularly when multiple consumers are involved. In such cases, where each row needs to be processed, it is crucial to prevent multiple consumers from selecting the same row simultaneously. By using the `FOR UPDATE SKIP LOCKED` clause, you can ensure that only one consumer locks and processes a specific row, while others skip over it and proceed to the next available row. This approach helps maintain data integrity and prevents conflicts in batch processing scenarios. [...] As you can see in the diagram above, the first user retrieves a record from the account table and attempts to debit the account by $70 based on the received data. At the same time, the second user performs the same operation, based on the data fetched from database. After these two updates, the account balance will be negative, which we want to avoid for the purpose of this article. How can we prevent such situations at the database level? In MySQL 8, we can achieve this in two ways: by using pessimistic or optimistic locking.\n",
      "token_estimate": 2029,
      "cached": false
    },
    "heuristic_score": 0.7,
    "llm_score": 0.0,
    "llm_reasoning": "API Error: 402",
    "credibility_score": 0.0,
    "credibility_reasoning": "API Error: 402"
  },
  {
    "id": 10,
    "query": "Current stock price of NVIDIA",
    "status": "success",
    "latency": 2.120495557785034,
    "result_count": 5,
    "data": {
      "query": "Current stock price of NVIDIA",
      "ai_overview": "As of 2026-02-15, the current stock price of NVIDIA (NVDA) is $184.94. This price reflects recent market activity. For the most up-to-date information, check real-time financial news sources.",
      "organic_results": [
        {
          "title": "NVDA: NVIDIA Corp - Stock Price, Quote and News - CNBC",
          "url": "https://www.cnbc.com/quotes/NVDA",
          "snippet": "NVIDIA Corp NVDA:NASDAQ ; Open187.48 ; Day High187.50 ; Day Low181.59 ; Prev Close186.94 ; 52 Week High212.",
          "score": 0.5,
          "embedding": null
        },
        {
          "title": "Stock Quote & Chart - NVIDIA Corporation",
          "url": "https://investor.nvidia.com/stock-info/stock-quote-and-chart/default.aspx",
          "snippet": "Stock Chart ; January 12, 2026, $184.94 ; January 09, 2026, $184.86 ; January 08, 2026, $185.04 ; January 07, 2026, $189.11.",
          "score": 0.85,
          "embedding": null
        },
        {
          "title": "NVIDIA Corporation (NVDA) Stock Price, News, Quote & History",
          "url": "https://finance.yahoo.com/quote/NVDA/",
          "snippet": "Oops, something went wrong ### News ### Life ### Entertainment ### Finance ### Sports ### New on Yahoo # Yahoo Finance We are experiencing some temporary issues. The market data on this page is currently delayed. # NVIDIA Corporation (NVDA) ### 8.76% ### 1.08% ### 2.06% ### 0.24% ### 42.55% ### 1,149.49% ### 427,191.46% ## News headlines NVIDIA continues to demonstrate strong growth prospects driven by AI demand, with partners like Vertiv reporting impressive earnings. The company's fundamentals remain robust, presenting a compelling case for long-term investment amidst increasing global data center spending. [...] Q1 FY26 Q2 FY26 Q3 FY26 ### Analyst Insights: NVDA ### Top Analyst ### Analyst Price Targets ### Analyst Recommendations ### Latest Rating ### Statistics: NVDA ### Valuation Measures Market Cap 4.54T Enterprise Value 4.49T Trailing P/E 46.27 Forward P/E 24.33 PEG Ratio (5yr expected) 0.72 Price/Sales (ttm) 24.56 Price/Book (mrq) 38.21 Enterprise Value/Revenue 24.01 Enterprise Value/EBITDA 37.73 ### Financial Highlights #### Profitability and Income Statement Profit Margin 53.01% Return on Assets (ttm) 53.53% Return on Equity (ttm) 107.36% Revenue (ttm) 187.14B Net Income Avi to Common (ttm) 99.2B Diluted EPS (ttm) 4.04 #### Balance Sheet and Cash Flow Total Cash (mrq) 60.61B Total Debt/Equity (mrq) 9.10% Levered Free Cash Flow (ttm) [...",
          "score": 0.5,
          "embedding": null
        },
        {
          "title": "NVIDIA Corp. (NVDA) Stock Price Today & Analysis | Buy on Gotrade",
          "url": "https://www.heygotrade.com/en/us-stock/nvda",
          "snippet": "Home US Stock Blog News Insider Market Outlook Join us FAQ Legal central Press Global Indonesia # NVIDIA Corp. (NVDA) Stock Price Today & Analysis NVDA company logo ### Valuation ### Earnings Per Share ### Income Statement ### Dividend ### Solvency ## About NVIDIA Corp. Nvidia Corporation is an American multinational technology company incorporated in Delaware and based in Santa Clara, California. It designs graphics processing units (GPUs) for the gaming and professional markets, as well as system on a chip units (SoCs) for the mobile computing and automotive market. Nvidia expanded its presence in the gaming industry with its handheld Shield Portable, Shield Tablet, and Shield Android TV and its cloud gaming service GeForce Now. ## FAQ ## Related news [...] ## FAQ ## Related news ### SoftBank\u2019s All-In on OpenAI Pays Off: Valuation Hits Record Highs SoftBank\u2019s All-In on OpenAI Pays Off: Valuation Hits Record Highs ### IPO Signal Flashing as Anthropic Hits $380B Valuation IPO Signal Flashing as Anthropic Hits $380B Valuation ### OpenAI Flags DeepSeek\u2019s Tactics to Congress OpenAI Flags DeepSeek\u2019s Tactics to Congress ### Software Stocks Tank: Is AI Killing the Industry? Software Stocks Tank: Is AI Killing the Industry? ### China Tech Plunges 20%, Is It Time to Buy? China Tech Plunges 20%, Is It Time to Buy? ### Buy NVDA stock View NVDA stock price and Buy/Sell NVDA. See news, trading signals, analyst predictions, and more in the app. AppLogo AppLogo Buy saham NVDA di Gotrade [...] AppLogo AppLogo Buy saham NVDA di Gotrade Facebook link Instagram link Twitter link Linkedin link Home Join us FAQ Legal Press Download App Store Download App Store Download Google Play Download Google Play 1 Returns reflected are cumulative returns from 5 Mar 2020, 5 Mar 2019, 5 Mar 2018 & 3 Mar 2017 till 4 Mar 2021 for 1 year, 2 years, 3 years & 4 years respectively with the exception of Spotify which reflect the cumulative returns from 5 Mar 2020 & 5 Mar 2019 till 3 Mar 2021 for 1 year & 2 year respectively. Past performance is not an indicator of future outcomes.",
          "score": 0.5,
          "embedding": null
        },
        {
          "title": "NASDAQ:NVDA Stock Price - NVIDIA Corporation - TradingView",
          "url": "https://www.tradingview.com/symbols/NASDAQ-NVDA/",
          "snippet": "NVIDIA Corporation NVIDIA Corporation NVIDIA Corporation # NVIDIA Corporation ## Chart\ufeff ## Key facts today ## Upcoming earnings\ufeff ## Key stats\ufeff ## Employees\ufeff ## About NVIDIA Corporation ## Related stocks ## Financials\ufeff ## Community forum\ufeff See all minds ## News\ufeff ## Ideas\ufeff NASDAQ:NVDA NASDAQ:NVDA NASDAQ:NVDA NASDAQ:NVDA NASDAQ:NVDA NASDAQ:NVDA NASDAQ:NVDA NASDAQ:NVDA NASDAQ:NVDA NASDAQ:NVDA See all ideas ## Technicals\ufeff ## Analyst rating\ufeff ## Seasonals\ufeff ## Highest yielding bonds\ufeff See all NVDA bonds ## ETFs holding the stock\ufeff Explore more ETFs ## Frequently Asked Questions [...] Explore more ETFs ## Frequently Asked Questions Select market data provided by ICE Data Services. Select reference data provided by FactSet. FactSet Research Systems Inc., American Bankers Association. CUSIP Database provided by FactSet Research Systems Inc. . SEC fillings and other documents provided by Quartr.\u00a9 2026 TradingView, Inc.",
          "score": 0.5,
          "embedding": null
        }
      ],
      "formatted_output": "# Search Results for: Current stock price of NVIDIA\n\n## AI Overview\nAs of 2026-02-15, the current stock price of NVIDIA (NVDA) is $184.94. This price reflects recent market activity. For the most up-to-date information, check real-time financial news sources.\n\n---\n\n### 1. Stock Quote & Chart - NVIDIA Corporation (Credibility Score: 0.85)\nURL: https://investor.nvidia.com/stock-info/stock-quote-and-chart/default.aspx\nSnippet: Stock Chart ; January 12, 2026, $184.94 ; January 09, 2026, $184.86 ; January 08, 2026, $185.04 ; January 07, 2026, $189.11.\n\n### 2. NVDA: NVIDIA Corp - Stock Price, Quote and News - CNBC (Credibility Score: 0.5)\nURL: https://www.cnbc.com/quotes/NVDA\nSnippet: NVIDIA Corp NVDA:NASDAQ ; Open187.48 ; Day High187.50 ; Day Low181.59 ; Prev Close186.94 ; 52 Week High212.\n\n### 3. NVIDIA Corporation (NVDA) Stock Price, News, Quote & History (Credibility Score: 0.5)\nURL: https://finance.yahoo.com/quote/NVDA/\nSnippet: Oops, something went wrong ### News ### Life ### Entertainment ### Finance ### Sports ### New on Yahoo # Yahoo Finance We are experiencing some temporary issues. The market data on this page is currently delayed. # NVIDIA Corporation (NVDA) ### 8.76% ### 1.08% ### 2.06% ### 0.24% ### 42.55% ### 1,149.49% ### 427,191.46% ## News headlines NVIDIA continues to demonstrate strong growth prospects driven by AI demand, with partners like Vertiv reporting impressive earnings. The company's fundamentals remain robust, presenting a compelling case for long-term investment amidst increasing global data center spending. [...] Q1 FY26 Q2 FY26 Q3 FY26 ### Analyst Insights: NVDA ### Top Analyst ### Analyst Price Targets ### Analyst Recommendations ### Latest Rating ### Statistics: NVDA ### Valuation Measures Market Cap 4.54T Enterprise Value 4.49T Trailing P/E 46.27 Forward P/E 24.33 PEG Ratio (5yr expected) 0.72 Price/Sales (ttm) 24.56 Price/Book (mrq) 38.21 Enterprise Value/Revenue 24.01 Enterprise Value/EBITDA 37.73 ### Financial Highlights #### Profitability and Income Statement Profit Margin 53.01% Return on Assets (ttm) 53.53% Return on Equity (ttm) 107.36% Revenue (ttm) 187.14B Net Income Avi to Common (ttm) 99.2B Diluted EPS (ttm) 4.04 #### Balance Sheet and Cash Flow Total Cash (mrq) 60.61B Total Debt/Equity (mrq) 9.10% Levered Free Cash Flow (ttm) [...\n\n### 4. NVIDIA Corp. (NVDA) Stock Price Today & Analysis | Buy on Gotrade (Credibility Score: 0.5)\nURL: https://www.heygotrade.com/en/us-stock/nvda\nSnippet: Home US Stock Blog News Insider Market Outlook Join us FAQ Legal central Press Global Indonesia # NVIDIA Corp. (NVDA) Stock Price Today & Analysis NVDA company logo ### Valuation ### Earnings Per Share ### Income Statement ### Dividend ### Solvency ## About NVIDIA Corp. Nvidia Corporation is an American multinational technology company incorporated in Delaware and based in Santa Clara, California. It designs graphics processing units (GPUs) for the gaming and professional markets, as well as system on a chip units (SoCs) for the mobile computing and automotive market. Nvidia expanded its presence in the gaming industry with its handheld Shield Portable, Shield Tablet, and Shield Android TV and its cloud gaming service GeForce Now. ## FAQ ## Related news [...] ## FAQ ## Related news ### SoftBank\u2019s All-In on OpenAI Pays Off: Valuation Hits Record Highs SoftBank\u2019s All-In on OpenAI Pays Off: Valuation Hits Record Highs ### IPO Signal Flashing as Anthropic Hits $380B Valuation IPO Signal Flashing as Anthropic Hits $380B Valuation ### OpenAI Flags DeepSeek\u2019s Tactics to Congress OpenAI Flags DeepSeek\u2019s Tactics to Congress ### Software Stocks Tank: Is AI Killing the Industry? Software Stocks Tank: Is AI Killing the Industry? ### China Tech Plunges 20%, Is It Time to Buy? China Tech Plunges 20%, Is It Time to Buy? ### Buy NVDA stock View NVDA stock price and Buy/Sell NVDA. See news, trading signals, analyst predictions, and more in the app. AppLogo AppLogo Buy saham NVDA di Gotrade [...] AppLogo AppLogo Buy saham NVDA di Gotrade Facebook link Instagram link Twitter link Linkedin link Home Join us FAQ Legal Press Download App Store Download App Store Download Google Play Download Google Play 1 Returns reflected are cumulative returns from 5 Mar 2020, 5 Mar 2019, 5 Mar 2018 & 3 Mar 2017 till 4 Mar 2021 for 1 year, 2 years, 3 years & 4 years respectively with the exception of Spotify which reflect the cumulative returns from 5 Mar 2020 & 5 Mar 2019 till 3 Mar 2021 for 1 year & 2 year respectively. Past performance is not an indicator of future outcomes.\n\n### 5. NASDAQ:NVDA Stock Price - NVIDIA Corporation - TradingView (Credibility Score: 0.5)\nURL: https://www.tradingview.com/symbols/NASDAQ-NVDA/\nSnippet: NVIDIA Corporation NVIDIA Corporation NVIDIA Corporation # NVIDIA Corporation ## Chart\ufeff ## Key facts today ## Upcoming earnings\ufeff ## Key stats\ufeff ## Employees\ufeff ## About NVIDIA Corporation ## Related stocks ## Financials\ufeff ## Community forum\ufeff See all minds ## News\ufeff ## Ideas\ufeff NASDAQ:NVDA NASDAQ:NVDA NASDAQ:NVDA NASDAQ:NVDA NASDAQ:NVDA NASDAQ:NVDA NASDAQ:NVDA NASDAQ:NVDA NASDAQ:NVDA NASDAQ:NVDA See all ideas ## Technicals\ufeff ## Analyst rating\ufeff ## Seasonals\ufeff ## Highest yielding bonds\ufeff See all NVDA bonds ## ETFs holding the stock\ufeff Explore more ETFs ## Frequently Asked Questions [...] Explore more ETFs ## Frequently Asked Questions Select market data provided by ICE Data Services. Select reference data provided by FactSet. FactSet Research Systems Inc., American Bankers Association. CUSIP Database provided by FactSet Research Systems Inc. . SEC fillings and other documents provided by Quartr.\u00a9 2026 TradingView, Inc.\n",
      "token_estimate": 1112,
      "cached": false
    },
    "heuristic_score": 0.6799999999999999,
    "llm_score": 0.0,
    "llm_reasoning": "API Error: 402",
    "credibility_score": 0.0,
    "credibility_reasoning": "API Error: 402"
  }
]